id,cleaned_text,cluster,cluster_name
9t0gqz,"Hi, I wish to share my journey of getting disciplined.",70,discipline / disciplined
9t0gqz,I hope you will take something away from this :).,-1,life / just
9t0gqz,"I would like to mention that I'm not a native English speaker, so forgive me for any grammar and/or spelling mistakes.",-1,life / just
9t0gqz,Start reading non-fiction and apply it in your life.,196,reading / read
9t0gqz,"Work on your physiology, it should be the foundation for productivity and discipline.",-1,life / just
9t0gqz,Lessen the amount of superstimuli in your life to get more dopamine (motivation).,41,dopamine / activities
9t0gqz,"Flow activities should be the goal in life, not mind numbing pleasure.",42,flow / activity
9t0gqz,Start a bullet journal where you color code all activities you do each day positive or negative.,-1,life / just
9t0gqz,It all started when I realized I had hit rock bottom.,-1,life / just
9t0gqz,I was getting up at 3pm everyday.,210,sleep / wake
9t0gqz,"Only ate junkfood, lay in bed watching YouTube and smoking a lot of weed.",-1,life / just
9t0gqz,My room was always a complete mess.,215,cleaning / clean
9t0gqz,I completely disregarded my study while I was living of a study loan.,118,school / college
9t0gqz,Every night I would hang out with a friend who would do the same and we'd smoke weed and watch screens until about 5 am.,-1,life / just
9t0gqz,It really was rock bottom.,-1,life / just
9t0gqz,This went on for a long time until I saw I had to change my life.,183,life / time
9t0gqz,# HABIT BUILDING,174,habits / habit
9t0gqz,I read a book called The Slight Edge.,-1,life / just
9t0gqz,"The idea of the book was that with consistent, incremental improvement, anyone could reach anything.",-1,life / just
9t0gqz,"It also debunked the idea of a 'quantum leap', which at first I believed in.",-1,life / just
9t0gqz,I liked the idea and started implementing it to form positive habits in my life.,-1,life / just
9t0gqz,"I started with nofap, meditation, reading, cleaning and some more.",14,meditation / minutes
9t0gqz,I made a lot of mistakes when I first started out.,-1,life / just
9t0gqz,So some advice on habit building I have accumulated is this:,174,habits / habit
9t0gqz,DON'T TRUST MOTIVATION.,189,motivation / motivated
9t0gqz,Motivation is good if it's there but it shouldn't be the foundation of the habits you create.,189,motivation / motivated
9t0gqz,"because motivation isn't always there, and when it's gone you also lose the habits that you build on top of it.",189,motivation / motivated
9t0gqz,I experienced this a lot of times.,81,experienced / wonder
9t0gqz,"I would have a streak of 100+ days meditation, miss 3 days and completely give up until I had the motivation again to start over.",14,meditation / minutes
9t0gqz,So how can I build habits then?,174,habits / habit
9t0gqz,Do it based on willpower.,50,willpower / relying
9t0gqz,"The big difference is not to say to yourself ""I'm gonna read 20 pages every day because I'm so motivated to gain knowledge."" But that you say ""I'm going force myself to start reading everyday because I will have enough willpower to always do that.""",-1,life / just
9t0gqz,"The key is that if you make the requirement so small that you can always do it, you will never fail.",-1,life / just
9t0gqz,So doing for example 1 pushup everyday.,72,push / doing
9t0gqz,You will never fail that requirement.,154,fail / time
9t0gqz,"But if you have very little motivation one day and think about doing 20 pushups, it just seems intimidating and you don't do it.",72,push / doing
9t0gqz,"Some people might say ""only starting to read or doing 1 push up will never get me anywhere."" And I agree, but the thing is that you can do more.",72,push / doing
9t0gqz,And you will usually do more.,-1,life / just
9t0gqz,"Once you forced yourself, with willpower, to get into push up position and do 1 push up, you'll probably think ""I can do one more, and one more"" and so on.",72,push / doing
9t0gqz,"Same for reading, once you've forced yourself to sit in a chair with a book and started reading, you wont stop after just 1 word.",196,reading / read
9t0gqz,You will do a lot more than the initial requirement more times then not.,-1,life / just
9t0gqz,"It will also give you a sense of ""I did this"".",-1,life / just
9t0gqz,"Especially if your requirement is, say, 1 push up, and you do 10.",72,push / doing
9t0gqz,You will have done 9 extra.,160,time / hard
9t0gqz,As opposed to when you require yourself to do 20 and do 10.,-1,life / just
9t0gqz,You will have done 10 too little.,160,time / hard
9t0gqz,"Try it right now, force yourself on the ground to do one push up.",72,push / doing
9t0gqz,I'm sure you have the willpower to do that.,50,willpower / relying
9t0gqz,The key is to make the requirement so small you will never fail it.,-1,life / just
9t0gqz,"Build the habit on a foundation of willpower, if motivation comes along, that's great.",-1,life / just
9t0gqz,The one habit that has done the most for my life is to read non-fiction.,196,reading / read
9t0gqz,I bought an e-reader and started to read daily.,196,reading / read
9t0gqz,I recommend buying an e-reader a lot.,196,reading / read
9t0gqz,Here are some of the benefits:,-1,life / just
9t0gqz,"\- Very portable, whenever I'm in public transport I pull it out and read some pages.",-1,life / just
9t0gqz,\- Buying books is instant and you can read anything you'd like,195,books / classics
9t0gqz,\- If you have little money there are a lot of places where you can download ebooks for free,-1,life / just
9t0gqz,"\- It has a backlight, so you can read in your bed, lying on your side, in the dark.",-1,life / just
9t0gqz,Most come with blue light filters as well.,-1,life / just
9t0gqz,Some of the benefits of reading non-fiction,196,reading / read
9t0gqz,\- You can learn directly from great people,-1,life / just
9t0gqz,\- There are books on anything that you find interesting (for me it's psychology),187,book / life
9t0gqz,\- There are a lot of self-help books on the market that will give you advice that you can practically apply in your life.,152,self / help
9t0gqz,"I'm sure there are a lot more, but for the sake of not writing a book as a post this will do.",133,sure / post
9t0gqz,I think the most important thing as a prerequisite for discipline is good physiology.,70,discipline / disciplined
9t0gqz,If you aren't feeling good it's hard to do things that would count as disciplined behavior.,70,discipline / disciplined
9t0gqz,So that's why I would recommend reading some books about physiology.,-1,life / just
9t0gqz,"Books that have had a profound impact on my life are; Mini habits, Meet Your Happy Chemicals, The HeartMath Solution, The Willpower Instinct, Cupid's Poisoned Arrow, Flow: The Psychology of Optimal Experience and Awareness Through Movement.",187,book / life
9t0gqz,"If your read all these books you will learn; how to create healthy habits in your life without making it hard; how your brain chemicals work; how to instantly lower stress and deal with negative thought and emotion, how willpower works, why it matters and how to get more of it; how orgasm induces neurochemical brain changes for 2 weeks and how it's evolutionary designed to break romantic relationships; what a flow experience is, and why it should be the goal for all activities in life to turn into one; that everyone stops progressing in the most basic things like breathing, posture etc.",-1,life / just
9t0gqz,"because only the minimal in life is needed to get on, it also provides lessons on how to improve these parts of life.",-1,life / just
9t0gqz,Gaining knowledge in this field will give you the ability to make the changes in your life that will benefit your overall feeling.,75,year / current
9t0gqz,"Feeling good overall, in your body and mind, is required for doing productive things.",186,productive / work
9t0gqz,# DOPAMINE,41,dopamine / activities
9t0gqz,I'm a psychology student so when I got into self help I was naturally interested in the brain's place in self improvement.,152,self / help
9t0gqz,Dopamine is the key player here.,41,dopamine / activities
9t0gqz,Most people think dopamine is responsible for 'pleasure'.,41,dopamine / activities
9t0gqz,This is a big misunderstanding.,98,sense / makes
9t0gqz,Dopamine is actually responsible for 'wanting' and motivation.,41,dopamine / activities
9t0gqz,"When the dopamine part of the brain was first discovered, it was discovered in rats.",41,dopamine / activities
9t0gqz,The researchers hooked up a lever to the rats' dopamine circuit to shock the dopamine circuit (mimicking dopamine release) whenever the rats would pull the lever.,41,dopamine / activities
9t0gqz,The rats soon ignored anything else and only pulled the lever until they died of starvation and fatigue.,-1,life / just
9t0gqz,Next the researchers (this one is a bit cruel) would have 2 levers on the opposite sides of a cage that would produce a 'dopamine hit' if pressed after the other.,41,dopamine / activities
9t0gqz,To make it interesting they put an electrically charged grid in between that would give the rats a painful shock if they walked over it.,41,dopamine / activities
9t0gqz,So now the rats would have to cross the grid every time they wanted another 'dopamine hit'.,41,dopamine / activities
9t0gqz,Shockingly (lol) the rats would run across it until they burned of their legs and couldn't walk anymore.,-1,life / just
9t0gqz,The researchers concluded from these experiments that this dopamine circuit was responsible for creating pleasure.,41,dopamine / activities
9t0gqz,Nowadays this is proved to be wrong and the actual function of the dopamine circuit is believed to be wanting and motivation.,41,dopamine / activities
9t0gqz,Most things people like to do give a lot of dopamine (much more than anything would have given in nature).,41,dopamine / activities
9t0gqz,"Things like watching TV (or netflix), internet, drugs, processed foods, porn, gambling and videogames.",127,porn / addiction
9t0gqz,Things that give us a lot of dopamine tend to be addicting.,41,dopamine / activities
9t0gqz,"No wonder I was only smoking, watching screens and lying in bed when I hit rock bottom.",-1,life / just
9t0gqz,"Now, why should you care?",-1,life / just
9t0gqz,The reason is very simple.,103,simple / reason
9t0gqz,Exposure to high dopamine for longer periods of time REDUCES DOPAMINE RECEPTORS.,41,dopamine / activities
9t0gqz,"Lower dopamine receptors give you lower motivation, lower concentration and less mental sharpness.",41,dopamine / activities
9t0gqz,With there being a lot of supernaturally high dopamine giving activities and substances available to us we should all be aware in what amount we should consume them.,41,dopamine / activities
9t0gqz,This is the reason why there are more college and university dropouts more than ever before.,-1,life / just
9t0gqz,Why so many people are unhappy at work.,-1,life / just
9t0gqz,And why there are more cases of depression than ever before (depression is linked to lower dopamine).,41,dopamine / activities
9t0gqz,Big companies know about this and use it to sell us as much as possible and keep them on their platforms for longer.,-1,life / just
9t0gqz,"They put the exact amount of sugar in all foods so that we like it the most, they design their platforms so you stay on them a lot (Facebook and Instagram), they implement gambling into games so that we play them more (Fortnite).",-1,life / just
9t0gqz,So what to take away from all this?,-1,life / just
9t0gqz,Lessen the amount of activities you do each day that give you a lot of dopamine and don't add anything to your life.,41,dopamine / activities
9t0gqz,This will give you a natural amount of dopamine receptors again and will make it a lot easier to stay concentrated while reading or learning an instrument for example.,41,dopamine / activities
9t0gqz,# FLOW ACTIVITIES,47,business / final
9t0gqz,"1 book that has made a profound impact on my life is the book Flow, The Psychology of Optimal Experience.",187,book / life
9t0gqz,The idea of the book is that there are certain activities that for which your brain needs 100% of  it's power to be focused on the activity.,187,book / life
9t0gqz,This is when you reach a 'Flow state'.,42,flow / activity
9t0gqz,"In this state you lose the idea of the self, you lose track of time and are only focused on the task at hand.",194,procrastinate / procrastination
9t0gqz,For example when you drive somewhere and you get there and don't remember how you got there.,-1,life / just
9t0gqz,Flow occurs when your skill matches the challenge of the activity.,42,flow / activity
9t0gqz,"When your skill is too high, you will be bored, when the challenge is too high you will be anxious.",-1,life / just
9t0gqz,"The key idea from this book, for me, was the difference between pleasure and enjoyment.",41,dopamine / activities
9t0gqz,Pleasure activities are ones that give the high amount of dopamine.,41,dopamine / activities
9t0gqz,"Whereas enjoyable activities also give dopamine, but also make you better at the task and will often produce a state of Flow.",41,dopamine / activities
9t0gqz,"Enjoyment produces growth, pleasure does not.",41,dopamine / activities
9t0gqz,I think that any activity in life that is not a pure pleasure activity can be made into a flow activity.,42,flow / activity
9t0gqz,It's one of my goals in life to fill my day with enjoyable activities.,-1,life / just
9t0gqz,"It made me realize I wanted to fill my day with making music and reading, not with smoking and watching TV.",-1,life / just
9t0gqz,# JOURNALING,176,journaling / right
9t0gqz,One of the best habits I have build is journaling.,176,journaling / right
9t0gqz,More specifically bullet journaling.,176,journaling / right
9t0gqz,I'm not sure if this is the official way to do it but this is what I do and what works for me.,88,things / work
9t0gqz,People pay coaches a lot of money to do something they can do themselves as well; give feedback.,73,coach / people
9t0gqz,"All a coach does is tell you what you've done, and where you can improve.",73,coach / people
9t0gqz,This is something you can do yourself easily by bullet journaling.,176,journaling / right
9t0gqz,My method: I have a simple notebook where I use the left and right page for 1 day.,-1,life / just
9t0gqz,In the morning I write down some things I want to do that day on the left page.,-1,life / just
9t0gqz,If there are things I wanted to do yesterday I write them down for today.,-1,life / just
9t0gqz,I also write a bit about how I feel.,-1,life / just
9t0gqz,Recently I've been doing some affirmations as well on that page.,90,post / questions
9t0gqz,"You can skip this entire left page, I personally like it, but I can understand how it's a bit much for some people.",-1,life / just
9t0gqz,You could also experiment with it and change it up how you like it.,20,small / start
9t0gqz,The real magic (and the reason I made the coach analogy) is on the right page.,73,coach / people
9t0gqz,Here is where I write down every influential activity I do.,-1,life / just
9t0gqz,I won't write down things like 'have breakfast' or 'short chat with roommate'.,-1,life / just
9t0gqz,I write down everything that has a positive or a negative meaning (some things are neutral like doing groceries).,-1,life / just
9t0gqz,Then at the end of the day I will use a marker to color code every activity either green (positive) or red (negative).,-1,life / just
9t0gqz,So for example:,92,example / instance
9t0gqz,(green) get up at 6am,210,sleep / wake
9t0gqz,(green) take a cold shower,-1,life / just
9t0gqz,(green) meditate,14,meditation / minutes
9t0gqz,(red) smoke a joint,13,smoking / like
9t0gqz,(red) waste an hour on Netflix,165,youtube / netflix
9t0gqz,(green) go to school,-1,life / just
9t0gqz,(red) hangout with X toxic friend and drink beer,-1,life / just
9t0gqz,I hope you see what I meant with the coach analogy now.,73,coach / people
9t0gqz,You will get a lot of feedback on what you do each day.,-1,life / just
9t0gqz,When I first started doing this I was shocked by how much red activities I had and  made it a mission to get more green activities in there.,-1,life / just
9t0gqz,It was slow progress but steadily it got better.,-1,life / just
9t0gqz,"If you don't like the left part of the journaling (which is how most people recommend it), I would advice you to try the right page.",176,journaling / right
9t0gqz,"If you're gonna do one, it should be the right page.",176,journaling / right
9t0gqz,See it as a free life coach.,73,coach / people
9t0gqz,# SLEEP SCHEDULE,210,sleep / wake
9t0gqz,When I was at rock bottom my schedule was the furthest away from perfect that it could possibly be.,-1,life / just
9t0gqz,One of the first things I changed that lasted was my sleeping schedule.,210,sleep / wake
9t0gqz,I was done waking when it's almost dark already and still being tired.,210,sleep / wake
9t0gqz,Also I noticed that everything I did in the late evening wasn't productive (or even counterproductive) like watching screens and doing drugs,199,work / doing
9t0gqz,There are good reasons to wake up early (5-6-7 AM).,210,sleep / wake
9t0gqz,The best sleep you can get is the sleep between 10 and 12.,210,sleep / wake
9t0gqz,If you're still awake at 00:00 you will produce cortisol and adrenaline to keep you awake.,210,sleep / wake
9t0gqz,This isn't healthy.,222,healthy / food
9t0gqz,"Good sleep improves cognitive function, vitality and motivation by a lot.",210,sleep / wake
9t0gqz,"There are many more benefits to a good sleeping schedule, and I think it's well known that it's a lot better.",210,sleep / wake
9t0gqz,However most people think it's hard to change their schedule.,199,work / doing
9t0gqz,This is how you do it;,88,things / work
9t0gqz,\- Set your alarm at your goal wake up time (EG 6 am),210,sleep / wake
9t0gqz,"\- When it goes, get out of bed, immediately eat breakfast",210,sleep / wake
9t0gqz,\- Don't sleep the rest of the day,210,sleep / wake
9t0gqz,\- Make sure you stop all screens by 9:30 and are in bed before 10:00,145,make / sure
9t0gqz,"\- Set the alarm again, you will most likely wake up before it goes.",210,sleep / wake
9t0gqz,"It's as easy as this, now all you have to do is to stick with it.",88,things / work
9t0gqz,Start enjoying the vast amount if time you have available in the morning.,-1,life / just
9t0gqz,This post has gotten a lot longer than I anticipated.,90,post / questions
9t0gqz,I really appreciate you reading it all the way through.,90,post / questions
9t0gqz,If you have any questions feel free to post a comment or shoot me a message.,90,post / questions
9t0gqz,I hope some of this has been helpful and I hope you will find success and happiness in life!,90,post / questions
9t0gqz,It means a lot to me that I touched so many people.,124,means / life
9t0gqz,"I really appreciate all the comments, feedback and especially the positive vibes.",90,post / questions
9t0gqz,I wish you all a good journey!,90,post / questions
9t0gqz,"Hi, I wish to share my journey of getting disciplined. I hope you will take something away from this :). I would like to mention that I'm not a native English speaker, so forgive me for any grammar and/or spelling mistakes.",70,discipline / disciplined
9t0gqz,"Start reading non-fiction and apply it in your life. Work on your physiology, it should be the foundation for productivity and discipline.",-1,life / just
9t0gqz,Lessen the amount of superstimuli in your life to get more dopamine (motivation).,41,dopamine / activities
9t0gqz,"Flow activities should be the goal in life, not mind numbing pleasure.",42,flow / activity
9t0gqz,Start a bullet journal where you color code all activities you do each day positive or negative.,-1,life / just
9t0gqz,"It all started when I realized I had hit rock bottom. I was getting up at 3pm everyday. Only ate junkfood, lay in bed watching YouTube and smoking a lot of weed. My room was always a complete mess. I completely disregarded my study while I was living of a study loan. Every night I would hang out with a friend who would do the same and we'd smoke weed and watch screens until about 5 am. It really was rock bottom. This went on for a long time until I saw I had to change my life.",-1,life / just
9t0gqz,# HABIT BUILDING,174,habits / habit
9t0gqz,"I read a book called The Slight Edge. The idea of the book was that with consistent, incremental improvement, anyone could reach anything. It also debunked the idea of a 'quantum leap', which at first I believed in. I liked the idea and started implementing it to form positive habits in my life. I started with nofap, meditation, reading, cleaning and some more. I made a lot of mistakes when I first started out. So some advice on habit building I have accumulated is this:",174,habits / habit
9t0gqz,"DON'T TRUST MOTIVATION. Motivation is good if it's there but it shouldn't be the foundation of the habits you create. Why? because motivation isn't always there, and when it's gone you also lose the habits that you build on top of it. I experienced this a lot of times. I would have a streak of 100+ days meditation, miss 3 days and completely give up until I had the motivation again to start over.",189,motivation / motivated
9t0gqz,"So how can I build habits then? Do it based on willpower. The big difference is not to say to yourself ""I'm gonna read 20 pages every day because I'm so motivated to gain knowledge."" But that you say ""I'm going force myself to start reading everyday because I will have enough willpower to always do that.""",-1,life / just
9t0gqz,"The key is that if you make the requirement so small that you can always do it, you will never fail. So doing for example 1 pushup everyday. You will never fail that requirement. But if you have very little motivation one day and think about doing 20 pushups, it just seems intimidating and you don't do it.",72,push / doing
9t0gqz,"Some people might say ""only starting to read or doing 1 push up will never get me anywhere."" And I agree, but the thing is that you can do more. And you will usually do more. Once you forced yourself, with willpower, to get into push up position and do 1 push up, you'll probably think ""I can do one more, and one more"" and so on. Same for reading, once you've forced yourself to sit in a chair with a book and started reading, you wont stop after just 1 word. You will do a lot more than the initial requirement more times then not. It will also give you a sense of ""I did this"". Especially if your requirement is, say, 1 push up, and you do 10. You will have done 9 extra. As opposed to when you require yourself to do 20 and do 10. You will have done 10 too little.",72,push / doing
9t0gqz,"Try it right now, force yourself on the ground to do one push up. I'm sure you have the willpower to do that.",72,push / doing
9t0gqz,"The key is to make the requirement so small you will never fail it. Build the habit on a foundation of willpower, if motivation comes along, that's great.",20,small / start
9t0gqz,The one habit that has done the most for my life is to read non-fiction. I bought an e-reader and started to read daily. I recommend buying an e-reader a lot. Here are some of the benefits:,196,reading / read
9t0gqz,"\- Very portable, whenever I'm in public transport I pull it out and read some pages.",-1,life / just
9t0gqz,\- Buying books is instant and you can read anything you'd like,195,books / classics
9t0gqz,\- If you have little money there are a lot of places where you can download ebooks for free,195,books / classics
9t0gqz,"\- It has a backlight, so you can read in your bed, lying on your side, in the dark. Most come with blue light filters as well.",-1,life / just
9t0gqz,Some of the benefits of reading non-fiction,196,reading / read
9t0gqz,\- You can learn directly from great people,-1,life / just
9t0gqz,\- There are books on anything that you find interesting (for me it's psychology),187,book / life
9t0gqz,\- There are a lot of self-help books on the market that will give you advice that you can practically apply in your life.,152,self / help
9t0gqz,"I'm sure there are a lot more, but for the sake of not writing a book as a post this will do.",133,sure / post
9t0gqz,I think the most important thing as a prerequisite for discipline is good physiology. If you aren't feeling good it's hard to do things that would count as disciplined behavior. So that's why I would recommend reading some books about physiology.,70,discipline / disciplined
9t0gqz,"Books that have had a profound impact on my life are; Mini habits, Meet Your Happy Chemicals, The HeartMath Solution, The Willpower Instinct, Cupid's Poisoned Arrow, Flow: The Psychology of Optimal Experience and Awareness Through Movement.",187,book / life
9t0gqz,"If your read all these books you will learn; how to create healthy habits in your life without making it hard; how your brain chemicals work; how to instantly lower stress and deal with negative thought and emotion, how willpower works, why it matters and how to get more of it; how orgasm induces neurochemical brain changes for 2 weeks and how it's evolutionary designed to break romantic relationships; what a flow experience is, and why it should be the goal for all activities in life to turn into one; that everyone stops progressing in the most basic things like breathing, posture etc. because only the minimal in life is needed to get on, it also provides lessons on how to improve these parts of life.",-1,life / just
9t0gqz,"Gaining knowledge in this field will give you the ability to make the changes in your life that will benefit your overall feeling. Feeling good overall, in your body and mind, is required for doing productive things.",-1,life / just
9t0gqz,# DOPAMINE,41,dopamine / activities
9t0gqz,I'm a psychology student so when I got into self help I was naturally interested in the brain's place in self improvement.,152,self / help
