id,cleaned_text,cluster,cluster_name
tfifk3,You can sweep all that under the giant rug of self-compassion.,100,self / compassion
tfifk3,"Just when you finish, be sure to keep that broom handy. You’re going to need it.",215,cleaning / clean
tfifk3,\- Simon ㋛,0,simon / aristotle
tfifk3,"\* I don't mean to imply that ADHD or any ""neurodivergence"" is a sort of blessing or net benefit. It is a medical condition that causes difficulties and should be regarded and treated as such. My thesis here is that a lot of the suffering (but not all) comes from falling short on the expectations we put on ourselves. In my personal experience, the treatments that worked on me were focused on mindfulness, self-compassion, and acceptance.",-1,life / just
kwh2ej,"Have you ever stopped to question why when, say there’s a big bag of chips open in the kitchen pantry, you find yourself repeatedly moseying over on autopilot?",-1,life / just
kwh2ej,Have you ever *really* questioned that behavior?,-1,life / just
kwh2ej,Gotten down to the root cause?,-1,life / just
kwh2ej,We tend to joke about such a things.,-1,life / just
kwh2ej,"*“I literally have zero self-control or willpower; if there’s a bag of chips open, I’ll kill it in a day despite any promise I made to ration it for the week.”*",50,willpower / relying
kwh2ej,"Fine, so you avoid buying family-sized bags of chips—*gotta just stick to the dang perimeter when I shop at the grocery store*—but what about all your other vices which can’t be so easily avoided?",-1,life / just
kwh2ej,This is where things get less jokey as a workable solution evades us.,-1,life / just
kwh2ej,Let's get back to the original question.,110,hear / plainly
kwh2ej,"When we procrastinate; when we waste hours and hours on Reddit or YouTube despite knowing we’re screwing ourselves over, what do we tell ourselves?",-1,life / just
kwh2ej,What do assume is the root cause of our dreadfully lousy actions?,99,self / lack
kwh2ej,It’s all on us.,-1,life / just
kwh2ej,It's on our lack of self-control and self-discipline.,99,self / lack
kwh2ej,It's on our non-existing motivation and drive.,-1,life / just
kwh2ej,"We have some deficiency—we’re somehow broken, lacking some basic inner quality that seemingly every other functional human was born with.",-1,life / just
kwh2ej,"I wish I could tell you it’s not your fault, because it is.",-1,life / just
kwh2ej,"Actually, that’s only half correct because *here is the biggest life truth that—once internalized, once applied—changes everything.*",193,change / changes
kwh2ej,"**Unbeknownst to you, the concept of 'you', who ‘you’ are, is comprised of two separate entities.**",-1,life / just
kwh2ej,"First, there’s the Physical self.",63,self / observing
kwh2ej,It's composed of your body and it's spongy brain kept safe and warm in a hard skull.,-1,life / just
kwh2ej,"This organ, with it’s neuro-wiring and billions of chemical squirting cells, works to influence your behavior with the sole purpose of you surviving and hopefully replicating.",102,brain / neuroplasticity
kwh2ej,"And there’s the Observing Self; the ‘you’ that doesn’t exist with a physical dimension, but who can, nonetheless, observe.",63,self / observing
kwh2ej,"I feel like I’m about to lose you, so let’s use an example.",-1,life / just
kwh2ej,"It’ll seem ridiculous at first, but it’ll make it crystal clear what the heck I’m talking about.",97,stop / start
kwh2ej,"And this ain’t a philosophical lecture, so straight after we'll get to where this gets *practical*; where and how this can be applied to yield self-discipline.",70,discipline / disciplined
kwh2ej,I want you to say out loud (or whisper) the phrase: “there is a goat in the yard”.,1,goat / yard
kwh2ej,"Repeat it a few times… *there is a goat in the yard,* *there is a goat in the yard,* *there is a goat in the yard…*",1,goat / yard
kwh2ej,"Now, stop saying out loud, but keep repeating it in your head… *there is a goat in the yard, there is a goat in the yard, there is a goat in the yard…*",1,goat / yard
kwh2ej,Keep going.,97,stop / start
kwh2ej,See if you can observe those words.,-1,life / just
kwh2ej,"‘Look’ at them, point your attention to it as if there was a Bluetooth speaker behind you harping out those same words on loop.",164,phone / scrolling
kwh2ej,That right there was the two parts of ‘you’ at play.,-1,life / just
kwh2ej,"The Physical Self was physically active, as in millions of neurons were fired so that those mental ‘sounds’ could be made.",-1,life / just
kwh2ej,There’s nothing spiritual or metaphysical about this; a scientist could have probed your brain and mapped out the exact sequence of events that were needed to produce that thought.,-1,life / just
kwh2ej,"The 'you' observing all that, the thing removed from it, witnessing the mental sound, *that was the Observing Self.*",63,self / observing
kwh2ej,Here’s the kicker.,116,deal / thing
kwh2ej,"**The Physical Self is, and only is, responsible for all your ‘willpower failings’.",50,willpower / relying
kwh2ej,"Not the real you, not the Observing Self.**",63,self / observing
kwh2ej,"You see, the Physical Self...",63,self / observing
kwh2ej,is an idiot.,98,sense / makes
kwh2ej,It still thinks it's the year negative 72 000.,30,years / year
kwh2ej,It still thinks we're all somewhere in the wild Savanna's of Africa where food is *extremely* scarce and threats are coming at you from every angle.,65,lives / survival
kwh2ej,"So the Physical Self does stuff—literally, it secrets chemicals like dopamine—all with the intent to help you survive in a world we've long ago abandoned.",-1,life / just
kwh2ej,"For example, you eat tasty chips on autopilot because they contain carbohydrate.",-1,life / just
kwh2ej,"Where/when the brain evolved, carbs were ridiculously rare and available temporarily (fruiting plants are seasonal).",-1,life / just
kwh2ej,"So when you taste some, it triggers an alarm that announces, “Hey!",-1,life / just
kwh2ej,It’s harvest time!!,44,food / pleasure
kwh2ej,"Eat as much as possible before the source dries up; more than we need right now so that we can store the excess glucose in some fat cells to have a chance at making it through the long, cold winter.” But the winter never comes.",-1,life / just
kwh2ej,"There never was a reason for us to evolve a stopping mechanism; so when our species was thrown into a new era of abundant and cheap starchy foods, the obesity epidemic was the inevitable outcome.",66,discontent / evolution
kwh2ej,Then there's social media.,162,just / social
kwh2ej,"You peruse social media on autopilot because by thumbing through images of people displaying their fabulous lifestyles, your brain associates yourselves with them.",-1,life / just
kwh2ej,"It doesn’t know what a ‘screen’ is, it just takes in visual data and thinks you are there with them; like you are part of their entourage.",164,phone / scrolling
kwh2ej,"And being part of an in-group of high status people would be awesome for survival, so we evolved to crave and seek more of it constantly.",-1,life / just
kwh2ej,The brain doesn’t know it’s all fake; that it’s all vicarious.,-1,life / just
kwh2ej,The same thing goes for porn.,165,youtube / netflix
kwh2ej,"I could go on with countless examples but the point I'm making is that all your irrational behavior; all your rationalizing, procrastination and binging; all these things are orchestrated by the Physical Self doing what it thinks it's supposed to do.",-1,life / just
kwh2ej,But we forget that.,-1,life / just
kwh2ej,Or we don't want to hear it.,137,song / speech
kwh2ej,"Instead we blame the core of ourselves, we blame the Observing Self.",63,self / observing
kwh2ej,"So we all have some ridiculously outdated wiring aiming at influencing out behavior, thinking it's ensuring our survival, when really it's making us sick and miserable.",-1,life / just
kwh2ej,So how do we get it to stop?,-1,life / just
kwh2ej,There is nothing we can do directly to make it stop.,-1,life / just
kwh2ej,But we can give it *space*.,43,response / space
kwh2ej,As Steven Covey writes:,32,paradox / colossal
kwh2ej,">“Between stimulus and response, there is a space.",43,response / space
kwh2ej,In that space is our power to choose our response.,43,response / space
kwh2ej,In our response lies our growth and our freedom.”,43,response / space
kwh2ej,This is how I work that quote in my day to day life:,27,quote / comments
kwh2ej,At some point in my day I'll get a craving or an impulse to check Reddit.,-1,life / just
kwh2ej,"When that happens, I stop.",97,stop / start
kwh2ej,I sit there and I do what I can to just observe the impulse.,147,impulse / autopilot
kwh2ej,I *there is a goat in my yard* the shit out of it until I'm completely detached and just watching it without judgement.,1,goat / yard
kwh2ej,"Next, with the 10 000 watt lightbulb of awareness, I scrutinize it and question it from every angle.",62,action / taking
kwh2ej,"99 times out of 100, I end up easily rejecting it.",-1,life / just
kwh2ej,I know too much.,-1,life / just
kwh2ej,I know where these impulses are coming from.,147,impulse / autopilot
kwh2ej,"I know it's just faulty programming, so I just don't trust it.",5,programming / primal
kwh2ej,I almost never trust these impulses.,-1,life / just
kwh2ej,I hear the rationalizations and excuses and I call them lies.,-1,life / just
kwh2ej,Manipulations.,-1,life / just
kwh2ej,"To be clear, sometimes I forget.",-1,life / just
kwh2ej,Sometimes I still act on impulse.,147,impulse / autopilot
kwh2ej,"Literally, as I write this, not a couple hours ago I was scrolling through Reddit rather than paying attention at a work meeting.",199,work / doing
kwh2ej,"Autopilot is still autopilot and in that periods I was mindless, as in my Observing Self was dissolved into the experience.",147,impulse / autopilot
kwh2ej,It happens.,81,experienced / wonder
kwh2ej,"But still, when I catch myself, it's becoming more and more of a habit to detach and take a step back (and I have set up numerous reminders to 'plug into the present moment').",-1,life / just
kwh2ej,"I am able to be compassionate with myself when I falter; to remind myself that I have a brain that simply evolved for a totally different environment, so it did what it was supposed to do (but it's still an idiot).",-1,life / just
kwh2ej,"I can even step back and away from the negative emotions that swells when I falter, and still, I do my best not to identify with all that.",178,emotions / negative
kwh2ej,"I look at those emotions and I say, *ah, there it is… the feeling of stress and regret for procrastinating.",-1,life / just
kwh2ej,"Thanks ol’ brain for secreting all that cortisol like a sabretooth tiger is behind me, but it’s actually not needed*.",41,dopamine / activities
kwh2ej,And I wait until it all dissipates.,-1,life / just
kwh2ej,And it always dissipates.,-1,life / just
kwh2ej,">“Between stimulus and response, there is a space.",43,response / space
kwh2ej,In that space is our power to choose our response.,43,response / space
kwh2ej,In our response lies our growth and our freedom.”,43,response / space
kwh2ej,\- Simon ㋛,0,simon / aristotle
kwh2ej,"Have you ever stopped to question why when, say there’s a big bag of chips open in the kitchen pantry, you find yourself repeatedly moseying over on autopilot? Have you ever *really* questioned that behavior? Gotten down to the root cause?",147,impulse / autopilot
kwh2ej,"We tend to joke about such a things. *“I literally have zero self-control or willpower; if there’s a bag of chips open, I’ll kill it in a day despite any promise I made to ration it for the week.”*",-1,life / just
kwh2ej,"Fine, so you avoid buying family-sized bags of chips—*gotta just stick to the dang perimeter when I shop at the grocery store*—but what about all your other vices which can’t be so easily avoided? This is where things get less jokey as a workable solution evades us.",-1,life / just
kwh2ej,"Let's get back to the original question. When we procrastinate; when we waste hours and hours on Reddit or YouTube despite knowing we’re screwing ourselves over, what do we tell ourselves? What do assume is the root cause of our dreadfully lousy actions?",194,procrastinate / procrastination
kwh2ej,"It’s all on us. It's on our lack of self-control and self-discipline. It's on our non-existing motivation and drive. We have some deficiency—we’re somehow broken, lacking some basic inner quality that seemingly every other functional human was born with.",99,self / lack
kwh2ej,"I wish I could tell you it’s not your fault, because it is. Actually, that’s only half correct because *here is the biggest life truth that—once internalized, once applied—changes everything.*",138,know / broken
kwh2ej,"**Unbeknownst to you, the concept of 'you', who ‘you’ are, is comprised of two separate entities.**",-1,life / just
kwh2ej,"First, there’s the Physical self. It's composed of your body and it's spongy brain kept safe and warm in a hard skull. This organ, with it’s neuro-wiring and billions of chemical squirting cells, works to influence your behavior with the sole purpose of you surviving and hopefully replicating.",102,brain / neuroplasticity
kwh2ej,"And there’s the Observing Self; the ‘you’ that doesn’t exist with a physical dimension, but who can, nonetheless, observe.",63,self / observing
kwh2ej,"I feel like I’m about to lose you, so let’s use an example. It’ll seem ridiculous at first, but it’ll make it crystal clear what the heck I’m talking about. And this ain’t a philosophical lecture, so straight after we'll get to where this gets *practical*; where and how this can be applied to yield self-discipline.",70,discipline / disciplined
kwh2ej,Ok. I want you to say out loud (or whisper) the phrase: “there is a goat in the yard”.,1,goat / yard
kwh2ej,"Repeat it a few times… *there is a goat in the yard,* *there is a goat in the yard,* *there is a goat in the yard…*",1,goat / yard
kwh2ej,"Now, stop saying out loud, but keep repeating it in your head… *there is a goat in the yard, there is a goat in the yard, there is a goat in the yard…*",1,goat / yard
kwh2ej,"Keep going. See if you can observe those words. ‘Look’ at them, point your attention to it as if there was a Bluetooth speaker behind you harping out those same words on loop.",-1,life / just
kwh2ej,"Boom. That right there was the two parts of ‘you’ at play. The Physical Self was physically active, as in millions of neurons were fired so that those mental ‘sounds’ could be made. There’s nothing spiritual or metaphysical about this; a scientist could have probed your brain and mapped out the exact sequence of events that were needed to produce that thought.",63,self / observing
kwh2ej,"The 'you' observing all that, the thing removed from it, witnessing the mental sound, *that was the Observing Self.*",63,self / observing
kwh2ej,"Here’s the kicker. **The Physical Self is, and only is, responsible for all your ‘willpower failings’. Not the real you, not the Observing Self.**",63,self / observing
kwh2ej,"You see, the Physical Self... is an idiot. It still thinks it's the year negative 72 000. It still thinks we're all somewhere in the wild Savanna's of Africa where food is *extremely* scarce and threats are coming at you from every angle. So the Physical Self does stuff—literally, it secrets chemicals like dopamine—all with the intent to help you survive in a world we've long ago abandoned.",-1,life / just
kwh2ej,"For example, you eat tasty chips on autopilot because they contain carbohydrate. Where/when the brain evolved, carbs were ridiculously rare and available temporarily (fruiting plants are seasonal). So when you taste some, it triggers an alarm that announces, “Hey! It’s harvest time!! Go go go! Eat as much as possible before the source dries up; more than we need right now so that we can store the excess glucose in some fat cells to have a chance at making it through the long, cold winter.” But the winter never comes. There never was a reason for us to evolve a stopping mechanism; so when our species was thrown into a new era of abundant and cheap starchy foods, the obesity epidemic was the inevitable outcome.",-1,life / just
kwh2ej,"Then there's social media. You peruse social media on autopilot because by thumbing through images of people displaying their fabulous lifestyles, your brain associates yourselves with them. It doesn’t know what a ‘screen’ is, it just takes in visual data and thinks you are there with them; like you are part of their entourage. And being part of an in-group of high status people would be awesome for survival, so we evolved to crave and seek more of it constantly. The brain doesn’t know it’s all fake; that it’s all vicarious.",165,youtube / netflix
kwh2ej,"The same thing goes for porn. I could go on with countless examples but the point I'm making is that all your irrational behavior; all your rationalizing, procrastination and binging; all these things are orchestrated by the Physical Self doing what it thinks it's supposed to do.",-1,life / just
kwh2ej,"But we forget that. Or we don't want to hear it. Instead we blame the core of ourselves, we blame the Observing Self.",63,self / observing
kwh2ej,"So we all have some ridiculously outdated wiring aiming at influencing out behavior, thinking it's ensuring our survival, when really it's making us sick and miserable. So how do we get it to stop?",-1,life / just
kwh2ej,There is nothing we can do directly to make it stop. But we can give it *space*. As Steven Covey writes:,-1,life / just
kwh2ej,">“Between stimulus and response, there is a space. In that space is our power to choose our response. In our response lies our growth and our freedom.”",43,response / space
kwh2ej,This is how I work that quote in my day to day life:,27,quote / comments
kwh2ej,"At some point in my day I'll get a craving or an impulse to check Reddit. When that happens, I stop. I sit there and I do what I can to just observe the impulse. I *there is a goat in my yard* the shit out of it until I'm completely detached and just watching it without judgement. Next, with the 10 000 watt lightbulb of awareness, I scrutinize it and question it from every angle.",147,impulse / autopilot
kwh2ej,"99 times out of 100, I end up easily rejecting it. I know too much. I know where these impulses are coming from. I know it's just faulty programming, so I just don't trust it. I almost never trust these impulses. I hear the rationalizations and excuses and I call them lies. Manipulations. Trickery.",-1,life / just
kwh2ej,"To be clear, sometimes I forget. Sometimes I still act on impulse. Literally, as I write this, not a couple hours ago I was scrolling through Reddit rather than paying attention at a work meeting. Autopilot is still autopilot and in that periods I was mindless, as in my Observing Self was dissolved into the experience. It happens.",147,impulse / autopilot
kwh2ej,"But still, when I catch myself, it's becoming more and more of a habit to detach and take a step back (and I have set up numerous reminders to 'plug into the present moment'). I am able to be compassionate with myself when I falter; to remind myself that I have a brain that simply evolved for a totally different environment, so it did what it was supposed to do (but it's still an idiot).",147,impulse / autopilot
kwh2ej,"I can even step back and away from the negative emotions that swells when I falter, and still, I do my best not to identify with all that. I look at those emotions and I say, *ah, there it is… the feeling of stress and regret for procrastinating. Thanks ol’ brain for secreting all that cortisol like a sabretooth tiger is behind me, but it’s actually not needed*. And I wait until it all dissipates. And it always dissipates.",178,emotions / negative
kwh2ej,">“Between stimulus and response, there is a space. In that space is our power to choose our response. In our response lies our growth and our freedom.”",43,response / space
kwh2ej,\- Simon ㋛,0,simon / aristotle
gs12al,My therapist said this to me last week and it blew my mind.,-1,life / just
gs12al,"It makes all the sense in the world - every self help book, method, is essentially working around this principle of learning how to be content with not being instantly gratified all the time.",152,self / help
gs12al,"Every addiction, bad habit, procrastination is a result of what your body's need for instant gratification.",194,procrastinate / procrastination
gs12al,"Once we understand how to cut that cord, we find out the key to a happier and more fulfilling life.",-1,life / just
gs12al,"When he put it like that, he blew my mind.",82,potential / head
gs12al,"My therapist said this to me last week and it blew my mind. It makes all the sense in the world - every self help book, method, is essentially working around this principle of learning how to be content with not being instantly gratified all the time. Every addiction, bad habit, procrastination is a result of what your body's need for instant gratification. Once we understand how to cut that cord, we find out the key to a happier and more fulfilling life. When he put it like that, he blew my mind.",194,procrastinate / procrastination
j3m6ml,"You can't control everything, but you can control how you respond to things.",-1,life / just
j3m6ml,Everything is fleeting.,-1,life / just
j3m6ml,Even the best fall down sometimes.,-1,life / just
j3m6ml,You're not everyone's cup of tea.,111,just / feels
j3m6ml,The world does not owe you anything.,-1,life / just
j3m6ml,"No one is going to fix you, but yourself.",56,gotta / thinking
j3m6ml,Overworking does not mean productive.,186,productive / work
j3m6ml,You always make time for what you love.,-1,life / just
j3m6ml,"No matter what happens, you're never going to be satisfied.",68,means / happy
j3m6ml,"There is no ""perfect"" time to start working.",-1,life / just
j3m6ml,"1. You can't control everything, but you can control how you respond to things.",-1,life / just
j3m6ml,2. Everything is fleeting.,-1,life / just
j3m6ml,3. Even the best fall down sometimes.,-1,life / just
j3m6ml,4. You're not everyone's cup of tea.,160,time / hard
j3m6ml,5. The world does not owe you anything.,160,time / hard
j3m6ml,"6. No one is going to fix you, but yourself.",160,time / hard
j3m6ml,7. Overworking does not mean productive.,186,productive / work
j3m6ml,8. You always make time for what you love.,160,time / hard
j3m6ml,"9. No matter what happens, you're never going to be satisfied.",160,time / hard
j3m6ml,"10. There is no ""perfect"" time to start working.",160,time / hard
1kik842,Not the flashy stuff.,-1,life / just
1kik842,Not cold showers or waking up at 5 AM.,216,cold / showers
1kik842,"I mean something stupidly simple and almost invisible-
like putting your phone in another room while working,
or writing 3 lines in a journal every night.",-1,life / just
1kik842,What’s yours?,-1,life / just
1kik842,Let’s build a list of underrated habits that actually work-because maybe we all need less “hustle” and more of what actually helps.,174,habits / habit
1kik842,Edit- Thanks everyone for sharing genuinely.,90,post / questions
1kik842,Finally we have built a Mega Thread of Beautiful habits ✨,174,habits / habit
1kik842,Not the flashy stuff.,-1,life / just
1kik842,Not cold showers or waking up at 5 AM.,216,cold / showers
1kik842,I mean something stupidly simple and almost invisible-,-1,life / just
1kik842,"like putting your phone in another room while working,",164,phone / scrolling
1kik842,or writing 3 lines in a journal every night.,-1,life / just
1kik842,What’s yours?,-1,life / just
1kik842,Let’s build a list of underrated habits that actually work-because maybe we all need less “hustle” and more of what actually helps.,174,habits / habit
1kik842,Edit- Thanks everyone for sharing genuinely. Finally we have built a Mega Thread of Beautiful habits ✨,90,post / questions
m5ongo,I just concluded my first interview after getting my degree.,-1,life / just
m5ongo,"I also had several certifications so I felt rather good about everything, and if nothing else I figured it would be great practice.",75,year / current
m5ongo,One hour later I realized how little I actually know.,-1,life / just
m5ongo,Relatively basic questions had me stumbling around like a fool.,-1,life / just
m5ongo,All the knowledge I thought was only going to ever be on school tests was suddenly being asked of me and I realized I retained almost none of it.,-1,life / just
m5ongo,It was easily the most embarrassing moment of my life.,-1,life / just
m5ongo,"My interviewer, Seth, was straight with me.",-1,life / just
m5ongo,He told me immediately that I wasn't going to get the job.,-1,life / just
m5ongo,He said while I seemed like a good person to work with my grasp on the technical side was too weak for consideration.,-1,life / just
m5ongo,"He was nothing but pleasant, if critical, and I hold him no ill will.",-1,life / just
m5ongo,"But man, was that one hell of a wake up call.",82,potential / head
m5ongo,I suddenly remembered all those nights I repeated quizzes until I memorized the answers rather than actually learning anything.,-1,life / just
m5ongo,All the questions I solved with Google rather than with my own knowledge.,-1,life / just
m5ongo,All the things I thought were rote and wouldn't apply in real-life I'm being asked about in an interview.,-1,life / just
m5ongo,And I was ashamed of myself.,-1,life / just
m5ongo,I made poor decision after poor decision and it led me to this.,94,decision / make
m5ongo,Not to mention my poor health/fitness I've been meaning to fix for years.,-1,life / just
m5ongo,I'm a mess.,-1,life / just
m5ongo,But I don't have to be.,-1,life / just
