id,cleaned_text,cluster,cluster_name
kf9t7n,"And those are all significant risks and/or potentially painful experiences, but they don't take away from a child's enjoyment because the child doesn't think about those risks. It's the worrying parent that does. The parent who is fearing their child might hurt themselves, or that their child might get hurt, feel hurt, be hurt by others, i.e. other kids. And sometimes these worries that the worrying parent has for their children affects their child's enjoyment. It limits their freedom, it limits their experiences, it limits the amount of fun they can have.",146,child / hurt
kf9t7n,So to piece it together. I'm limiting the amount of 'joy' I can experience by worrying about things I shouldn't be worried about. This 'avoidance' is like not going out for a run because you're afraid you might twist your ankle. Yet by staying at home and sitting around or sleeping. You risk many other health problems and issues far worse than a sprained ankle. And that's not all. The sprained ankle is only a 'potential risk' with a very low probability of it actually happening. The health issues that come from no exercise vary in significance greatly and there is a far greater chance of lasting adverse effects from lack of exercise than a sprained ankle.,-1,life / just
kf9t7n,"On top of that, emotionally speaking, it feels great to be able to rest your weary legs and tired feet after a nice long run. Whereas sitting down all day does not feel great. You don't find any pleasure in 'resting' after having not done anything. To sum it up. Pain and suffering is inevitable. But it's the choice that's yours. Do you want it now and consequently live out a happier, healthier life because you faced it. Or do you want it later and life a miserable and meaningless life, full of regret and sorrow. Because you're going to experience pain and suffering one way or another. It's the choice of facing and dealing with it head-on, or saving it for later. The choice is yours.",-1,life / just
juou3v,You know it won’t.,97,stop / start
juou3v,You’re not just going to wake up as a productive supersoldier.,210,sleep / wake
juou3v,"You have to start implementing seemingly small changes today, and building on them every day or every week.",-1,life / just
juou3v,"Our bodies and minds don’t like dramatic change of any kind, so you need to take small steps in the right direction.",-1,life / just
juou3v,"Get up 15 minutes earlier than usual, not 3 hours.",210,sleep / wake
juou3v,"Have warm showers then turn them cold for the last quarter, so you don’t just end up avoiding showers or having extremely short ones because that’s just unhygienic.",216,cold / showers
juou3v,"Try to workout one day per week more than you’re currently doing, not daily.",214,week / exercise
juou3v,Start surfing the internet a little less than usual instead of blocking all your favourite diversion sites.,-1,life / just
juou3v,"Add some steamed vegetables to your dinner, drink a bit more water than usual - don’t just throw out your entire fridge and restock it with organic food.",-1,life / just
juou3v,Read a few pages of a book instead of expecting to get through an entire chapter.,196,reading / read
juou3v,Have one difficult conversation you’ve been putting off and go from there - don’t just flip your persona overnight.,-1,life / just
juou3v,Make eye contact and some conversation with someone you’re attracted to where it’s appropriate- don’t try to get rejected 10 times per day so you’re immune to it or whatever that literature suggests.,180,girlfriend / make
juou3v,"Drop masturbation back to once or twice per week (or thereabouts) instead of doing some total abstinence, although only do it when you’re in the mood not procrasturbating.",194,procrastinate / procrastination
juou3v,Acknowledge any progress no matter how small.,-1,life / just
juou3v,Accept failures no matter how large.,154,fail / time
juou3v,"Expecting to flip your lifestyle upside down overnight because you just read “you can’t hurt me” or listened to a jocko willink podcast might work for a few hours, maybe even a few days, but the change will eventually seem too drastic and you’ll rebound back to your old habits.",-1,life / just
juou3v,This may seem slack and counterintuitive but it’s essentially learning how to self reward to create sustainable change.,-1,life / just
juou3v,Recent Neuroscientific research also corroborates that this ability is instrumental in allowing an individual to achieve formidable long term goals.,-1,life / just
juou3v,For too many years I believed that my ultra disciplined alter ego was right around the corner - so today was one last rodeo of dissolution before I pulled myself up by the bootstraps and got disciplined.,70,discipline / disciplined
juou3v,Only later did I truly realise this was an excuse to avoid taking any action.,62,action / taking
juou3v,So start now.,97,stop / start
juou3v,You’ll get there eventually.,83,going / eventually
juou3v,P.S I’m posting this to help keep myself accountable because I’ve been in a bad place lately,-1,life / just
juou3v,It won’t. You know it won’t.,97,stop / start
juou3v,You’re not just going to wake up as a productive supersoldier.,210,sleep / wake
juou3v,"You have to start implementing seemingly small changes today, and building on them every day or every week.",-1,life / just
juou3v,"Our bodies and minds don’t like dramatic change of any kind, so you need to take small steps in the right direction.",-1,life / just
juou3v,"Get up 15 minutes earlier than usual, not 3 hours.",210,sleep / wake
juou3v,"Have warm showers then turn them cold for the last quarter, so you don’t just end up avoiding showers or having extremely short ones because that’s just unhygienic.",216,cold / showers
juou3v,"Try to workout one day per week more than you’re currently doing, not daily.",214,week / exercise
juou3v,Start surfing the internet a little less than usual instead of blocking all your favourite diversion sites.,-1,life / just
juou3v,"Add some steamed vegetables to your dinner, drink a bit more water than usual - don’t just throw out your entire fridge and restock it with organic food.",-1,life / just
juou3v,Read a few pages of a book instead of expecting to get through an entire chapter.,196,reading / read
juou3v,Have one difficult conversation you’ve been putting off and go from there - don’t just flip your persona overnight.,-1,life / just
juou3v,Make eye contact and some conversation with someone you’re attracted to where it’s appropriate- don’t try to get rejected 10 times per day so you’re immune to it or whatever that literature suggests.,180,girlfriend / make
juou3v,"Drop masturbation back to once or twice per week (or thereabouts) instead of doing some total abstinence, although only do it when you’re in the mood not procrasturbating.",194,procrastinate / procrastination
juou3v,Acknowledge any progress no matter how small. Accept failures no matter how large.,-1,life / just
juou3v,"Expecting to flip your lifestyle upside down overnight because you just read “you can’t hurt me” or listened to a jocko willink podcast might work for a few hours, maybe even a few days, but the change will eventually seem too drastic and you’ll rebound back to your old habits.",-1,life / just
juou3v,This may seem slack and counterintuitive but it’s essentially learning how to self reward to create sustainable change. Recent Neuroscientific research also corroborates that this ability is instrumental in allowing an individual to achieve formidable long term goals.,-1,life / just
juou3v,For too many years I believed that my ultra disciplined alter ego was right around the corner - so today was one last rodeo of dissolution before I pulled myself up by the bootstraps and got disciplined.,70,discipline / disciplined
juou3v,Only later did I truly realise this was an excuse to avoid taking any action.,62,action / taking
juou3v,So start now.,97,stop / start
juou3v,You’ll get there eventually.,83,going / eventually
juou3v,P.S I’m posting this to help keep myself accountable because I’ve been in a bad place lately,-1,life / just
1kor7sk,"For years, I dealt with constant fatigue and a complete lack of drive to do anything beyond the absolute essentials.",-1,life / just
1kor7sk,"Back when I was in school, I managed to graduate, but never reached the academic potential I knew I had.",118,school / college
1kor7sk,"Later, at work, I could hold down a job, but I never really thrived.",118,school / college
1kor7sk,"I always had intentions to eat better, exercise, and take care of myself, but despite the goals I set, I could never stick to anything long enough to see results.",-1,life / just
1kor7sk,"Over time, my health declined, and the cycle just kept repeating.",-1,life / just
1kor7sk,"I tried to boost my productivity with systems like David Allen’s GTD and countless optimization techniques, but none of it stuck, I simply couldn’t follow through.",-1,life / just
1kor7sk,"Eventually, I came across an episode of Huberman’s podcast where he talked about dopamine regulation.",41,dopamine / activities
1kor7sk,That episode changed everything.,183,life / time
1kor7sk,"I had always assumed that my lack of motivation was due to ADHD or something similar, but for the first time, I realized it might actually be tied to how I was engaging with habits and dopamine, something I could work on and influence.",-1,life / just
1kor7sk,"One thing became immediately obvious: like so many others, I was completely hooked on my phone.",164,phone / scrolling
1kor7sk,My day started and ended with scrolling.,164,phone / scrolling
1kor7sk,"After listening to that podcast, I saw clearly how overstimulated I had become.",-1,life / just
1kor7sk,Breaking that addiction became a full-on mission for me.,128,alcohol / easily
1kor7sk,"It wasn’t easy, but I eventually cut my screen time from over 7 hours a day to under an hour.",164,phone / scrolling
1kor7sk,And honestly?,-1,life / just
1kor7sk,That single change transformed my life.,183,life / time
1kor7sk,I started sleeping better.,210,sleep / wake
1kor7sk,My energy lasted through the day.,210,sleep / wake
1kor7sk,I now work out consistently because I actually enjoy it.,213,workout / fine
1kor7sk,I began cooking for myself and eating healthy.,-1,life / just
1kor7sk,I even left my job to start my own business.,-1,life / just
1kor7sk,"Looking back, it was hands-down the most impactful decision I ever made.",94,decision / make
1kor7sk,I genuinely believe this is something almost everyone is grappling with today.,-1,life / just
1kor7sk,"Whenever someone tells me they’re struggling with focus, discipline, or just improving their life, the first thing I suggest is tackling phone addiction.",-1,life / just
1kor7sk,It’s the keystone habit that makes room for all the other good habits.,174,habits / habit
1kor7sk,"Cutting back on screen time is hard, but here are a few things that helped me make a real difference:",164,phone / scrolling
1kor7sk,Delay phone use in the morning.,164,phone / scrolling
1kor7sk,Try waiting at least an hour after waking up before you touch your phone.,164,phone / scrolling
1kor7sk,"Your dopamine levels reset while you sleep, so mornings are when your self-control is strongest.",210,sleep / wake
1kor7sk,Take advantage of that window.,145,make / sure
1kor7sk,Use a screen time tracker that works for you.,164,phone / scrolling
1kor7sk,App blockers didn’t do much for me.,-1,life / just
1kor7sk,"What helped was switching to an app, that makes reducing screen time a kind of game, rewarding you with dopamine for staying off your phone.",164,phone / scrolling
1kor7sk,You can even play with friends.,-1,life / just
1kor7sk,"But there are other good ones out there too,  the key is finding one that keeps you engaged.",179,people / relationships
1kor7sk,Remove your most distracting apps from your phone.,164,phone / scrolling
1kor7sk,"You don’t need to delete your accounts, just remove the apps so you can only access them from a computer.",-1,life / just
1kor7sk,"When you do that, you’re forced to use them more intentionally instead of scrolling mindlessly.",164,phone / scrolling
1kor7sk,"For years, I dealt with constant fatigue and a complete lack of drive to do anything beyond the absolute essentials.",-1,life / just
1kor7sk,"Back when I was in school, I managed to graduate, but never reached the academic potential I knew I had. Later, at work, I could hold down a job, but I never really thrived. I always had intentions to eat better, exercise, and take care of myself, but despite the goals I set, I could never stick to anything long enough to see results. Over time, my health declined, and the cycle just kept repeating.",-1,life / just
1kor7sk,"I tried to boost my productivity with systems like David Allen’s GTD and countless optimization techniques, but none of it stuck, I simply couldn’t follow through.",191,follow / plan
1kor7sk,"Eventually, I came across an episode of Huberman’s podcast where he talked about dopamine regulation. That episode changed everything. I had always assumed that my lack of motivation was due to ADHD or something similar, but for the first time, I realized it might actually be tied to how I was engaging with habits and dopamine, something I could work on and influence.",41,dopamine / activities
1kor7sk,"One thing became immediately obvious: like so many others, I was completely hooked on my phone. My day started and ended with scrolling. After listening to that podcast, I saw clearly how overstimulated I had become.",-1,life / just
1kor7sk,"Breaking that addiction became a full-on mission for me. It wasn’t easy, but I eventually cut my screen time from over 7 hours a day to under an hour.",-1,life / just
1kor7sk,And honestly? That single change transformed my life.,183,life / time
1kor7sk,I started sleeping better. My energy lasted through the day. I now work out consistently because I actually enjoy it. I began cooking for myself and eating healthy. I even left my job to start my own business.,210,sleep / wake
1kor7sk,"Looking back, it was hands-down the most impactful decision I ever made.",94,decision / make
1kor7sk,"I genuinely believe this is something almost everyone is grappling with today. Whenever someone tells me they’re struggling with focus, discipline, or just improving their life, the first thing I suggest is tackling phone addiction. It’s the keystone habit that makes room for all the other good habits.",-1,life / just
1kor7sk,"Cutting back on screen time is hard, but here are a few things that helped me make a real difference:",164,phone / scrolling
1kor7sk,"Delay phone use in the morning. Try waiting at least an hour after waking up before you touch your phone. Your dopamine levels reset while you sleep, so mornings are when your self-control is strongest. Take advantage of that window.",164,phone / scrolling
1kor7sk,"Use a screen time tracker that works for you. App blockers didn’t do much for me. What helped was switching to an app, that makes reducing screen time a kind of game, rewarding you with dopamine for staying off your phone. You can even play with friends. But there are other good ones out there too,  the key is finding one that keeps you engaged.",164,phone / scrolling
1kor7sk,"Remove your most distracting apps from your phone. You don’t need to delete your accounts, just remove the apps so you can only access them from a computer. When you do that, you’re forced to use them more intentionally instead of scrolling mindlessly.",164,phone / scrolling
1hto2vk,spent a month researching and forcing myself to take cold showers every day.,216,cold / showers
1hto2vk,"ngl, it sounded like a stupid internet trend at first, but now i’m convinced it’s one of the easiest ways to build discipline and reset your brain.",70,discipline / disciplined
1hto2vk,here’s what i learned (with actual science to back it up):,-1,life / just
1hto2vk,**Why Cold showers are amazing**,216,cold / showers
1hto2vk,"*  seriously, nothing wakes you up faster than freezing water.",217,water / freezing
1hto2vk,"apparently, cold showers make your body release adrenaline, which is why you go from ""zombie mode"" to ""ready to fight a bear in like 10 seconds.",216,cold / showers
1hto2vk,">*A study in Medical Hypotheses says cold showers release norepinephrine, which is this brain chemical that makes you more alert and less blah.*",216,cold / showers
1hto2vk,"* after a cold shower, my brain feels calm.",216,cold / showers
1hto2vk,"It's not like magic or anything, but a study from 2007 says cold water can lower your stress hormone (cortisol).",216,cold / showers
1hto2vk,I feel it.,-1,life / just
1hto2vk,"*  I don't know how it works, but doing something so uncomfortable first thing in the morning makes the rest of my day feel easier.",210,sleep / wake
1hto2vk,"* if you can stand in the freezing water for 3 minutes, you can pretty much do anything.",217,water / freezing
1hto2vk,**How to survive the freezing hell**,-1,life / just
1hto2vk,"* trust me, don't jump strait into ice-cold water unless you wanna hate your life.",217,water / freezing
1hto2vk,start with 10-15 seconds at the end of a warm shower and slowly add more time every day.,-1,life / just
1hto2vk,"* when the cold hits, your brain is gonna scream ""Get out!"" but just use this method called box breathing, (inhale for 4 secs, hold for 4, exhale for 4.) Trust me.",217,water / freezing
1hto2vk,"* the more consistent you are, the less it sucks.",-1,life / just
1hto2vk,i missed one day and felt like a slug again.,-1,life / just
1hto2vk,don't miss a day.,-1,life / just
1hto2vk,**More research**,58,mishap / research
1hto2vk,">*A 2008 study says cold showers make your brain release beta-endorphines, which are like feel-good chemicals that make you happy.",216,cold / showers
1hto2vk,it's like a natural antidepressant.*,41,dopamine / activities
1hto2vk,>*PLOS ONE did a study and found people who took cold showers got sick less often.*,216,cold / showers
1hto2vk,">  
*Cold water also improves circulation and reduces inflammation, according to actual doctors.",216,cold / showers
1hto2vk,"so yeah, it's good for your body too.*",-1,life / just
1hto2vk,**Read this part**,59,read / matters
1hto2vk,wake the fuck up and stop taking the easy way out.,210,sleep / wake
1hto2vk,"life isn't gonna hand you discipline on a silver platter, and cold showers are the ultimate test to prove you can handle discomfort.",216,cold / showers
1hto2vk,"If you can't stand just 2 minutes of freezing water, how are you gonna handle real challenges?",217,water / freezing
1hto2vk,"cold showers aren't just about waking up, they're about rewiring your brain to stop being weak and start doing hard stuff.",216,cold / showers
1hto2vk,"stop overthinking it, stop making excuses, and just do it.",78,overthinking / stop
1hto2vk,"step into the freezing water, show yourself you're tougher than you think.",217,water / freezing
1hto2vk,"two weeks of this, and you'll walk out feeling like a new person.",-1,life / just
1hto2vk,no more complaining.,-1,life / just
1hto2vk,no more laziness.,-1,life / just
1hto2vk,"just raw, discipline.",70,discipline / disciplined
1hto2vk,Are you really going to say no just because it's fucking uncomfortable?,86,feel / uncomfortable
1hto2vk,"spent a month researching and forcing myself to take cold showers every day. ngl, it sounded like a stupid internet trend at first, but now i’m convinced it’s one of the easiest ways to build discipline and reset your brain. here’s what i learned (with actual science to back it up):",216,cold / showers
1hto2vk,**Why Cold showers are amazing**,216,cold / showers
1hto2vk,"*  seriously, nothing wakes you up faster than freezing water. apparently, cold showers make your body release adrenaline, which is why you go from ""zombie mode"" to ""ready to fight a bear in like 10 seconds.",216,cold / showers
1hto2vk,">*A study in Medical Hypotheses says cold showers release norepinephrine, which is this brain chemical that makes you more alert and less blah.*",216,cold / showers
1hto2vk,"* after a cold shower, my brain feels calm. It's not like magic or anything, but a study from 2007 says cold water can lower your stress hormone (cortisol). I feel it.",216,cold / showers
1hto2vk,"*  I don't know how it works, but doing something so uncomfortable first thing in the morning makes the rest of my day feel easier.",210,sleep / wake
1hto2vk,"* if you can stand in the freezing water for 3 minutes, you can pretty much do anything.",217,water / freezing
1hto2vk,**How to survive the freezing hell**,217,water / freezing
1hto2vk,"* trust me, don't jump strait into ice-cold water unless you wanna hate your life. start with 10-15 seconds at the end of a warm shower and slowly add more time every day.",217,water / freezing
1hto2vk,"* when the cold hits, your brain is gonna scream ""Get out!"" but just use this method called box breathing, (inhale for 4 secs, hold for 4, exhale for 4.) Trust me. It works.",217,water / freezing
1hto2vk,"* the more consistent you are, the less it sucks. i missed one day and felt like a slug again. don't miss a day.",-1,life / just
1hto2vk,**More research**,58,mishap / research
1hto2vk,">*A 2008 study says cold showers make your brain release beta-endorphines, which are like feel-good chemicals that make you happy. it's like a natural antidepressant.*",216,cold / showers
1hto2vk,>*PLOS ONE did a study and found people who took cold showers got sick less often.*,216,cold / showers
1hto2vk,"*Cold water also improves circulation and reduces inflammation, according to actual doctors. so yeah, it's good for your body too.*",216,cold / showers
1hto2vk,**Read this part**,59,read / matters
1hto2vk,"wake the fuck up and stop taking the easy way out. life isn't gonna hand you discipline on a silver platter, and cold showers are the ultimate test to prove you can handle discomfort. If you can't stand just 2 minutes of freezing water, how are you gonna handle real challenges? cold showers aren't just about waking up, they're about rewiring your brain to stop being weak and start doing hard stuff.",216,cold / showers
1hto2vk,"stop overthinking it, stop making excuses, and just do it. step into the freezing water, show yourself you're tougher than you think. two weeks of this, and you'll walk out feeling like a new person.",217,water / freezing
1hto2vk,"no more complaining. no more laziness. just raw, discipline.",70,discipline / disciplined
1hto2vk,Are you really going to say no just because it's fucking uncomfortable?,86,feel / uncomfortable
ijxtaa,**TL;DR:** Switch to Robot Mode where you don't care about how well you perform in the task.,134,mode / robot
ijxtaa,Then work in a timeframe you feel comfortable with.,-1,life / just
ijxtaa,Track and make your next day 1% better.,-1,life / just
ijxtaa,"People think that it's hard to switch to robot mode, or robot mode is not useful for tasks with high cognitive load tasks such as studying.",134,mode / robot
ijxtaa,It also seems like not everyone can get into a phase where they are unbothered by the outcome and their emotions.,178,emotions / negative
ijxtaa,"To me, robot mode is essentially a phase where you are doing the minimal shit within a timeframe because you have told yourself to, not because it helps your life better or etc.",134,mode / robot
ijxtaa,"It's NOT a mode where you consciously envision your goal coming true, or where you think about the good things about the job.",143,work / achievements
ijxtaa,"**Robot Mode is a mode where you say, ""I'm not going to do anything else other than this thing because I've instructed myself to do, and it's completely okay that I do a shitty job.""**",134,mode / robot
ijxtaa,My take is that robot mode is very effective for tasks that are brain-demanding.,134,mode / robot
ijxtaa,"Here's how I do things during the initial phase: for research, I spend half an hour typing nonsense; for researching graduate schools, I spend half an hour surfing a college website; for programming, I spend half a hour copying documentation.",199,work / doing
ijxtaa,"The most important thing are **iterations, which is why I include Tips 2 and 3.** You want many sessions improving a poorly done job, and getting from shitty to brilliant is usually faster than you thought.",-1,life / just
ijxtaa,"**Edit 2:** As pointed out by u/Gwendilater, u/dangsoggyoatmeal, u/June8th that I might have ADHD, I did ASRS (self-report test for ADHD) and **guess what I found, I do have ADHD.",-1,life / just
ijxtaa,"My life has been a lie – I thought I was just normal for being impatient, careless, and forgetful.**",163,finally / getting
ijxtaa,"I procrastinate a lot, and by tracking my work hours, I realize that I've only worked on things that matter for 4.5 hours every day.",199,work / doing
ijxtaa,"For the rest of the time, I spend it on Youtube, Facebook, and Reddit.",165,youtube / netflix
ijxtaa,Those negative emotions associated with a task drive a person to procrastinate.,194,procrastinate / procrastination
ijxtaa,"**I realize that the source of negative emotions is that we care about how well we perform in our task, and our ego doesn't want us to perform poorly.**",-1,life / just
ijxtaa,"If we know that we can do well in a task and we can complete it within an acceptable time frame (like in 15 minutes), we would not hesitate to do it.",-1,life / just
ijxtaa,"But when we cannot see ourselves confidently tackling the task, or when we see ourselves unable to complete it fast enough (such as cleaning the dishes in 5 minutes), we tend to procrastinate.",194,procrastinate / procrastination
ijxtaa,Our primal brain prefers not doing a task to doing a task poorly.,177,pain / task
ijxtaa,Here are the things that work for me:,88,things / work
