id,subreddit_name_prefixed,ups,upvote_ratio,advice,group
dfc5w8,r/getdisciplined,1561,0.97,"I already think about working out more and having a great body, so why isn't my body great yet?",Health
dfc5w8,r/getdisciplined,1561,0.97,"I already think about eating healthier and cleaning up my diet, so why is it still so hard?",Health
dfc5w8,r/getdisciplined,1561,0.97,"I already think about becoming disciplined and motivated towards my goals, so why am I still lazy? Why do I still procrastinate?",Self-Improvement
dfc5w8,r/getdisciplined,1561,0.97,"You aren't thinking about the qualities you should cultivate into your life in order to attract more high quality women. You're thinking about how every woman you find attractive turns you down, and how you'll never find a great woman.",Relationships
dfc5w8,r/getdisciplined,1561,0.97,"You aren't thinking about how to gain confidence and become more comfortable with yourself in a practical way. You're thinking about all the times you've embarrassed yourself and felt unworthy. You're constantly looking at other people who are more confident than you, and comparing yourself.",Self-Improvement
dfc5w8,r/getdisciplined,1561,0.97,"You aren't thinking about how you can earn more money at your current job, or thinking about a business idea you can work towards to earn a higher standard of living. You're thinking about how much your job sucks, and how unfair the pay is. You're thinking about how lucky you'd be if you were to win the lottery, and wouldn't have to work anymore for the rest of your life, and then sulk about the fact that it will probably never happen.",Finance
dfc5w8,r/getdisciplined,1561,0.97,"It isn't enough to simply think about your circumstances, you need to think of them in a productive way. There's no point to complaining about where you're at.",Mindset
dfc5w8,r/getdisciplined,1561,0.97,"Your job sucks? Yeah, you know. You think that every day. So how can you change that? What actions can you take today to start working towards a better mindset, or a different job, or your dream job, or a different environment entirely?",Career
dfc5w8,r/getdisciplined,1561,0.97,"It's not always going to be big steps, but any step at all is better than standing still and complaining about how you wish things were different.",Mindset
dfc5w8,r/getdisciplined,1561,0.97,"Everybody wishes their lives were better than they currently are. But only a few take control of their mindsets, and put it to work for them instead of against them.",Mindset
dfc5w8,r/getdisciplined,1561,0.97,"Last week, you promised yourself that you'd start going to the gym, or studying more, or eating healthier. You promised yourself you'd do it for some personal cause, and you thought about all the things you'd be able to do with this new development. You came to terms with how shitty your life would continue to be if you didn't make a change, and come the next day, you got started, with a fire in your stomach to stick with it, this time.",Self-Improvement
dfc5w8,r/getdisciplined,1561,0.97,"But 2 weeks later, you find you're right back where you started. Why? Is it because you're meant to be a piece of shit for the rest of your life? Is it because you aren't meant to be one of the 'healthy' people? One of the 'fit' people? One of the 'successful' people?",Self-Improvement
dfc5w8,r/getdisciplined,1561,0.97,No. It's because you lost focus.,Focus
dfc5w8,r/getdisciplined,1561,0.97,"The day before you took action towards your promise, you reflected on a lot of shit. You thought about your life, and where it is now. You thought about where you wanted to be, and why you weren't there yet. You thought about all the mistakes you've made, and how those mistakes screwed your life up bit by bit. You thought about how badly you wanted to change. You envisioned a life where you followed through on your promises from now on. You envisioned who you'd be in 3-6 months, following through with your fitness, diet, social, personal goals. You envisioned all the improvements you'd gain in your life, all the people you'd be around, all the women you'd cause to fall for you, all the family member's who'd congratulate you, all the associates who'd look at you in jealousy.",Focus
dfc5w8,r/getdisciplined,1561,0.97,"All this internal reflection caused you to hone your focus on one primary thing. Your goal. You spent about 1-2 hours thinking about all this stuff, so naturally, it's what you're focused on, and what you focus on, your draw to you (mindset, remember?). So all that fire? All that motivation and drive? It was just your mind doing what it does, putting all it's effort and energy on what you focus on.",Focus
dfc5w8,r/getdisciplined,1561,0.97,"So why do you lose that motivation and drive soon after gaining so much of it during the reflection period? Because once you finally make the last promise to yourself that this time is the final time, you stop reflecting. You foolishly believe that those 1-2 hours of intense reflection is going to provide you with all the drive and push you need to accomplish your life dream, goal, or ambition.",Focus
dfc5w8,r/getdisciplined,1561,0.97,"And in your foolishness, life punches you in the fucking mouth.",Reality Check
dfc5w8,r/getdisciplined,1561,0.97,"Life doesn't stop. Life doesn't give you a pass and say, 'Oh well since you have direction now, I'll just let you go by and harass the next poor sucker'. It doesn't work like that. Life doesn't stop for anyone, and if you don't constantly reaffirm for yourself what it is you want to focus on, primarily, life will always be happy to give you a million other things to think about in place of your dreams.",Reality Check
dfc5w8,r/getdisciplined,1561,0.97,"When you have those quarter-monthly crises, where you suddenly look at your life and think to yourself, 'What the fuck have I been doing? I need to make a change now'. That's just the first step. All the planning you find yourself doing, all the reflection and visualization you do, it's what fuels the internal fire within you, but that fire doesn't last. That focus doesn't last. It must be reapplied until your dream is achieved.",Focus
dfc5w8,r/getdisciplined,1561,0.97,"If the only time you really think about your goals is once every few months, when life takes a breather from beating your ass, you'll never truly change anything. Because you aren't giving your mind sometime to consistently focus on. You're just giving it a short nice thought to ponder over, before life is finished with it's break, and ready to hand you more fists.",Focus
dfc5w8,r/getdisciplined,1561,0.97,"You've got to take control of your mental focus, and reflect over the things you want, everyday. You've got to envision and visualize yourself achieving your goals, everyday. You've got to think about how bad your life will continue to be if you don't take action, everyday. Because as you continue to apply that focus, that fire within you will continue to grow.",Focus
dfc5w8,r/getdisciplined,1561,0.97,"Do I have to do it every single day, forever? No. Eventually, you'll developed the habit and self discipline to just get shit done. But that'll take about 3-4 weeks of constant reflection before you can let up. Until then, just understand the days you don't control your focus, your focus is controlled",Focus
y298ud,r/getdisciplined,1557,0.98,Realize that the habits are not the problem.,Mindset
y298ud,r/getdisciplined,1557,0.98,Fix the root cause of your bad habits.,Mindset
y298ud,r/getdisciplined,1557,0.98,Meditation is the practice of sitting for any given amount of time and staying aware/witnessing your brain.,Mindfulness
y298ud,r/getdisciplined,1557,0.98,"Validate yourself through the action you take or don’t take, not the results.",Mindset
y298ud,r/getdisciplined,1557,0.98,"Regret is the best guide. If you regret an action, that’s your conscience telling you to stop engaging in that activity.",Self-Awareness
1cle0ag,r/getdisciplined,1557,0.98,Your brain has spent 20 years perfecting neural connections to make you who you are.,Brain Science
1cle0ag,r/getdisciplined,1557,0.98,"Dopamine reinforces behaviors, making tasks easier to do next time.",Brain Science
1cle0ag,r/getdisciplined,1557,0.98,Your brain hates change because it thinks habits maximize survival.,Brain Science
1cle0ag,r/getdisciplined,1557,0.98,Self-improvement industry promises are unrealistic for most people.,Industry Critique
1cle0ag,r/getdisciplined,1557,0.98,"People like David Goggins are biologically abnormal, not typical examples.",Industry Critique
1cle0ag,r/getdisciplined,1557,0.98,Accept that your brain prefers familiar habits over new ones.,Habit Formation
1cle0ag,r/getdisciplined,1557,0.98,Make changes so small your brain doesn't notice.,Habit Formation
1cle0ag,r/getdisciplined,1557,0.98,"Break down habits into smaller, manageable steps.",Habit Formation
1cle0ag,r/getdisciplined,1557,0.98,"Change one thing at a time, not a million things at once.",Habit Formation
1cle0ag,r/getdisciplined,1557,0.98,Detach yourself from results-based progress and be patient.,Habit Formation
1cle0ag,r/getdisciplined,1557,0.98,"Start with one habit, like getting dressed for the gym, and commit to it for a month.",Habit Formation
qucx7p,r/getdisciplined,1553,0.97,Run your own race in your own pace,Personal Pace
qucx7p,r/getdisciplined,1553,0.97,Do not envy them,Personal Pace
qucx7p,r/getdisciplined,1553,0.97,You're not late. You're not early. You are very much on time,Personal Pace
icrw6v,r/getdisciplined,1542,0.99,Set your alarm with a message telling you to begin the habit,Cue Creation
icrw6v,r/getdisciplined,1542,0.99,Have the alarm cycle every day at the same time,Cue Creation
icrw6v,r/getdisciplined,1542,0.99,Use objects as cues,Cue Creation
icrw6v,r/getdisciplined,1542,0.99,Have your alarm across your room and out of arms reach,System Creation
icrw6v,r/getdisciplined,1542,0.99,Get all your healthy food ready for the week,System Creation
icrw6v,r/getdisciplined,1542,0.99,Focus on ONE habit at a time until it echoes,Habit Formation
icrw6v,r/getdisciplined,1542,0.99,Tell the voice in your head to shut the fuck up,Psychological Warfare
icrw6v,r/getdisciplined,1542,0.99,"Envision someone with a gun to your head, it’s that serious",Psychological Warfare
jof75l,r/getdisciplined,1545,0.98,Pain is temporary. Quitting lasts forever,Mental Toughness
jof75l,r/getdisciplined,1545,0.98,You can either be a quitter or getter,Mindset
jof75l,r/getdisciplined,1545,0.98,The problem with being a quitter is that it becomes a habit,Habit Formation
jof75l,r/getdisciplined,1545,0.98,"When you quit, the exact same pain doesn't ever go away",Consequences
jof75l,r/getdisciplined,1545,0.98,So the next time you think about quitting think about what you're projecting to the universe,Reflection
giutmz,r/getdisciplined,1546,0.99,"it doesn’t have to be perfect, just get something done",Perfectionism
giutmz,r/getdisciplined,1546,0.99,"do tasks little by little, instead of all at once",Productivity
hiq9eg,r/getdisciplined,1539,0.99,It's always today. It's perpetually NOW.,Time Perspective
hiq9eg,r/getdisciplined,1539,0.99,I'll do that later' literally means 'I'll never do that',Procrastination
hiq9eg,r/getdisciplined,1539,0.99,You don't have to work and work for hours and days on something you don't like.,Task Management
hiq9eg,r/getdisciplined,1539,0.99,You don't have to diet for weeks and weeks to lose weight.,Health
hiq9eg,r/getdisciplined,1539,0.99,You don't have to worry about tomorrow.,Anxiety
hiq9eg,r/getdisciplined,1539,0.99,All you have to do is DO IT NOW.,Action
hiq9eg,r/getdisciplined,1539,0.99,Even my lazy ass can do something difficult 'now' as opposed to doing it for hours/days/weeks/months/years.,Motivation
hiq9eg,r/getdisciplined,1539,0.99,Looking at a huge task can be greatly demotivating.,Task Management
hiq9eg,r/getdisciplined,1539,0.99,You just have to do it now. Now is just a moment of time - anybody can do anything for a single moment.,Action
7xmha1,r/getdisciplined,1541,0.95,Wake up at 6:30am every single morning.,Wake Up
7xmha1,r/getdisciplined,1541,0.95,Drink a glass of water as soon as you wake up.,Hydration
7xmha1,r/getdisciplined,1541,0.95,Plan out your entire day using MITs (Most Important Tasks).,Planning
7xmha1,r/getdisciplined,1541,0.95,Practice 5-10 minutes of mindfulness meditation.,Mindfulness
7xmha1,r/getdisciplined,1541,0.95,Go for a 10-20 minute run.,Exercise
7xmha1,r/getdisciplined,1541,0.95,Eat a nutritious breakfast with high fat and high protein.,Nutrition
7xmha1,r/getdisciplined,1541,0.95,Take the time to enjoy your breakfast without distractions.,Mindfulness
7xmha1,r/getdisciplined,1541,0.95,Make your bed every morning.,Habit Formation
p14c2u,r/getdisciplined,1536,0.99,I’ve made animated summaries of 50+ of the best self improvement books.,Resource Creation
p14c2u,r/getdisciplined,1536,0.99,I’ve made a list of the links for each of the videos so you can find and watch the summary of the book you are interested in more easily.,Resource Organization
p14c2u,r/getdisciplined,1536,0.99,I hope you'll be able to watch these and get a clearer idea or which ones you would be interested in reading fully.,Resource Utilization
iwt6w2,r/getdisciplined,1535,0.99,Train yourself to front-load your anxiety instead of avoid it,Anxiety Management
iwt6w2,r/getdisciplined,1535,0.99,"Engage with issues that cause anxiety, and not backing away from them",Anxiety Management
l1a0fv,r/getdisciplined,1524,0.99,Focus your attention on your breath.,Meditation Practice
l1a0fv,r/getdisciplined,1524,0.99,Note when you lose focus and gently return to the breath.,Meditation Practice
l1a0fv,r/getdisciplined,1524,0.99,Observe the mind's frenetic circus and reign it in.,Meditation Practice
l1a0fv,r/getdisciplined,1524,0.99,"Expect to falter and fail, and that's okay.",Mindset
l1a0fv,r/getdisciplined,1524,0.99,Accept and expect that you will falter a bit.,Mindset
l1a0fv,r/getdisciplined,1524,0.99,Be compassionate with yourself when you falter.,Self-Compassion
l1a0fv,r/getdisciplined,1524,0.99,Gently detach from vices when you catch yourself.,Self-Compassion
l1a0fv,r/getdisciplined,1524,0.99,Have hard written rules and remind yourself of them everyday.,Habit Formation
l1a0fv,r/getdisciplined,1524,0.99,Let go of striving for perfection.,Mindset
l1a0fv,r/getdisciplined,1524,0.99,Allow for some self-compassion.,Self-Compassion
l1a0fv,r/getdisciplined,1524,0.99,See the vices for what they are.,Habit Formation
l1a0fv,r/getdisciplined,1524,0.99,"Keep calm, be compassionate towards yourself, and return to the breath.",Mindset
hngkx4,r/getdisciplined,1525,0.98,train yourself to focus on the process instead of the outcome,Mindset
hngkx4,r/getdisciplined,1525,0.98,create a schedule with your goals and when you plan to do them,Structure
hngkx4,r/getdisciplined,1525,0.98,get disciplined by building habits,Discipline
hngkx4,r/getdisciplined,1525,0.98,start small when building habits,Habit Formation
hngkx4,r/getdisciplined,1525,0.98,"find joy in the process of doing things, not just the outcome",Mindset
hngkx4,r/getdisciplined,1525,0.98,write down your specific goals for each day in your to-do list,Structure
hf3fqz,r/getdisciplined,1522,0.99,Start by finding a morsel of something you like in that process,Find Positives
hf3fqz,r/getdisciplined,1522,0.99,"Now that you've found something you like, start concentrating on that aspect you like, whenever possible",Focus on Positives
hf3fqz,r/getdisciplined,1522,0.99,"For this step, whenever your mind shifts to thinking about the outcome or the negative aspects of the process, try to shift it back to thinking about those things you like",Refocus on Positives
hf3fqz,r/getdisciplined,1522,0.99,Even going from 0% process-focus to 50% process-focus would be a huge achievement,Goal Setting
1mjziec,r/getdisciplined,1522,0.98,The beautiful thing about self-esteem is that it can be built at any age.,Self-Esteem
1mjziec,r/getdisciplined,1522,0.98,Your brain has this filter that only lets you notice things that match what you believe about yourself.,Mindset
1mjziec,r/getdisciplined,1522,0.98,People with higher self-worth have higher dopamine levels naturally.,Self-Worth
1mjziec,r/getdisciplined,1522,0.98,"Start with tiny things that are easy to do daily, like putting sunscreen on or drinking water when you wake up.",Discipline
1mjziec,r/getdisciplined,1522,0.98,Your brain is constantly looking for evidence about who you are.,Mindset
1mjziec,r/getdisciplined,1522,0.98,Start giving your brain different evidence to work with.,Self-Esteem
7os2qa,r/getdisciplined,1512,0.96,Go 30 days without complaining.,Challenge
7os2qa,r/getdisciplined,1512,0.96,"Use a rubber band around your wrist. If you complain, ‘twang’ the band.",Mindfulness
7os2qa,r/getdisciplined,1512,0.96,Moaning is defined as speaking negatively without citing a solution.,Definition
7os2qa,r/getdisciplined,1512,0.96,Replace negative thoughts with something you appreciate.,Mindset
7os2qa,r/getdisciplined,1512,0.96,Become more analytical on how to solve bigger problems.,Problem-Solving
7os2qa,r/getdisciplined,1512,0.96,People generally tend to be a mirror of yourself reflecting back at you.,Influence
7os2qa,r/getdisciplined,1512,0.96,Distinguishing between complaining and reaching out for advice is essential.,Communication
1j8ui5u,r/getdisciplined,1508,0.98,Stop making venting your personality,Venting
1j8ui5u,r/getdisciplined,1508,0.98,Your friends and family are not your therapists,Support
1j8ui5u,r/getdisciplined,1508,0.98,Get into an active fix-it mindset,Problem-Solving
1j8ui5u,r/getdisciplined,1508,0.98,Others are not the yardstick of your success,Comparison
1j8ui5u,r/getdisciplined,1508,0.98,The world is not out there to 'get you',Perception
1j8ui5u,r/getdisciplined,1508,0.98,Stop saying 'I hate my life' - as a rule,Self-Talk
1j8ui5u,r/getdisciplined,1508,0.98,Stop saying 'I am never going to do (dream activity)' - as a rule,Self-Limitation
1j8ui5u,r/getdisciplined,1508,0.98,I am toxic because I choose to be so,Toxicity
1j8ui5u,r/getdisciplined,1508,0.98,Say sorry and move on,Accountability
1j8ui5u,r/getdisciplined,1508,0.98,Don't compete to have the worst life,Empathy
jg9icy,r/getdisciplined,1505,0.96,If I respected my self I would make sure my work shoes and my chef jacket was clean each working day,Self Respect
jg9icy,r/getdisciplined,1505,0.96,I would watch my mouth because I respect my workmates,Respect for Others
jg9icy,r/getdisciplined,1505,0.96,If I respected my team I would show up on time eager to get started,Team Respect
5tf7aw,r/getdisciplined,1505,0.92,Break every task into MICRO tasks,Task Management
5tf7aw,r/getdisciplined,1505,0.92,Write down the smallest tasks possible,Task Management
5tf7aw,r/getdisciplined,1505,0.92,Fold the list so you can see only 2-3 tasks at a time,Task Management
5tf7aw,r/getdisciplined,1505,0.92,Start with the smallest step possible,Task Management
5tf7aw,r/getdisciplined,1505,0.92,Create a MICRO-routine for each task,Task Management
5tf7aw,r/getdisciplined,1505,0.92,Get the ball rolling with easy tasks,Motivation
dc0ozu,r/getdisciplined,1498,0.98,I stopped drinking because of my dog.,Motivation
dc0ozu,r/getdisciplined,1498,0.98,I went straight home to my dog.,Motivation
dc0ozu,r/getdisciplined,1498,0.98,I took her for a walk.,Motivation
dc0ozu,r/getdisciplined,1498,0.98,"I go home straight away after work, drink less, and my dog is happier than ever.",Motivation
dc0ozu,r/getdisciplined,1498,0.98,Keeping my partner happy and healthy was more important to me than drinking.,Health
dc0ozu,r/getdisciplined,1498,0.98,His wellbeing and our healthy relationship was a form of pleasure.,Health
dc0ozu,r/getdisciplined,1498,0.98,Connecting pleasure and physical action is extremely powerful.,Behavioral Science
11t049j,r/getdisciplined,1498,0.98,Break down any task into an action step so small that you can complete it right away.,Task Management
11t049j,r/getdisciplined,1498,0.98,Make each goal so simple that there is truly no excuse to put it off.,Goal Setting
11t049j,r/getdisciplined,1498,0.98,"Instead of doing nothing, you’ve done something. Metaphorically, that is a 100% improvement from before.",Progress Mindset
11t049j,r/getdisciplined,1498,0.98,Great kaizen skills build upon each other.,Skill Development
11t049j,r/getdisciplined,1498,0.98,"If you find yourself skipping an important habit for multiple days or weeks, start over with kaizen.",Habit Formation
11t049j,r/getdisciplined,1498,0.98,"If you can’t, don’t, or won’t get started right away, the task is not small enough.",Task Management
gnoxlj,r/getdisciplined,1495,0.92,Waking up early isn't the answer,Sleep
gnoxlj,r/getdisciplined,1495,0.92,"Going to bed early is great and all, but it doesn't actually achieve anything",Sleep
gnoxlj,r/getdisciplined,1495,0.92,Doing the work is the secret is to success,Work Ethic
gnoxlj,r/getdisciplined,1495,0.92,"If you have to point your willpower at either sleeping/waking up early, or getting work done, chose getting work done",Work Ethic
c69ngr,r/getdisciplined,1484,0.96,"The key is not to prioritize what's on your schedule, but to schedule your priorities.",Time Management
c69ngr,r/getdisciplined,1484,0.96,"In order to discover your values and be more productive, you must learn to pay attention to what you've been paying attention to.",Self-Awareness
c69ngr,r/getdisciplined,1484,0.96,"Every one of your thoughts, emotions, and behaviors has an energy consequence, for better or worse.",Energy Management
c69ngr,r/getdisciplined,1484,0.96,"To be fully engaged, we must be physically energized, emotionally connected, mentally focused, and spiritually aligned with a purpose beyond our immediate self-interest.",Full Engagement
c69ngr,r/getdisciplined,1484,0.96,"There are four sources of energy—physical, emotional, mental, and spiritual.",Energy Sources
c69ngr,r/getdisciplined,1484,0.96,You must create a positive energy ritual to give your full attention to.,Energy Rituals
c69ngr,r/getdisciplined,1484,0.96,"Spend 30 minutes on focused, undistracted work that's meaningful to you, then step away from it.",Focus Management
c69ngr,r/getdisciplined,1484,0.96,Exercise and eat right and give adequate recovery.,Physical Energy
c69ngr,r/getdisciplined,1484,0.96,Join a Meetup group or Toastmasters. Leave your phone in the glove box of your car.,Emotional Energy
c69ngr,r/getdisciplined,1484,0.96,"Increase your capacity to do focused, undistracted work. Give adequate renewal.",Mental Energy
c69ngr,r/getdisciplined,1484,0.96,"Find out what motivates you. Discover the values of integrity, commitment, and honesty.",Spiritual Energy
nx8jtc,r/getdisciplined,1482,0.99,Working out is hard but eating junk and getting sick is also hard,Health
nx8jtc,r/getdisciplined,1482,0.99,Quitting smoking is hard but drinking and getting health complications is also hard,Health
nx8jtc,r/getdisciplined,1482,0.99,Studying is hard but not studying and scoring low is also hard,Education
op17p7,r/getdisciplined,1481,0.99,Prioritize your tasks and manage your time effectively,Time Management
op17p7,r/getdisciplined,1481,0.99,Set clear goals and create a routine,Goal Setting
op17p7,r/getdisciplined,1481,0.99,Stay organized and use tools like planners or apps,Organization
op17p7,r/getdisciplined,1481,0.99,Maintain a healthy work-life balance,Balance
op17p7,r/getdisciplined,1481,0.99,Build a strong support network,Support Network
op17p7,r/getdisciplined,1481,0.99,Stay focused and avoid distractions,Focus
dhpbf6,r/getdisciplined,1479,0.98,Only the disciplined ones in life are free,Discipline
dhpbf6,r/getdisciplined,1479,0.98,"If you're undisciplined, you are a slave to your moods and passions",Discipline
1ld75eq,r/getdisciplined,1470,0.98,"Daily must haves: good sleep, morning movement, one healthy meal. It's the fuel for everything else.",Self-Care
1ld75eq,r/getdisciplined,1470,0.98,"Seek out truly useful, timeless wisdom, not just what's popular.",Information
1ld75eq,r/getdisciplined,1470,0.98,"When things get heated or you face a big decision, always take 10 minutes (or more!) to think before you react.",Decision Making
1ld75eq,r/getdisciplined,1470,0.98,"Make tiny, consistent efforts every day toward your goals. Little steps add up to big wins.",Progress
1ld75eq,r/getdisciplined,1470,0.98,Focus on mastering what truly matters instead of being average at everything.,Focus
1ld75eq,r/getdisciplined,1470,0.98,"Always make money choices that build long-term independence. Keep debt low, save consistently.",Finance
1ld75eq,r/getdisciplined,1470,0.98,Spend time with people who challenge and inspire you. Avoid negativity when you can.,Relationships
1ld75eq,r/getdisciplined,1470,0.98,Don't quit when you hit a bump. Figure out what went wrong and tweak your plan.,Adaptability
1ld75eq,r/getdisciplined,1470,0.98,You learn best by trying things. Don't fear mistakes; they're your best teachers.,Learning
1ld75eq,r/getdisciplined,1470,0.98,"Be generous with your time, knowledge, and kindness. It makes your life, and the world, better.",Generosity
fi82qo,r/getdisciplined,1473,0.98,Let your mind be at peace and let it recover from the constant high levels of dopamine.,Mental Recovery
fi82qo,r/getdisciplined,1473,0.98,"Set a day aside without your internet, phone, computer, music and junk food.",Digital Detox
fi82qo,r/getdisciplined,1473,0.98,"Track all the low dopamine activities that you do: cleaning your room, reading a book, working, exercising.",Activity Tracking
fi82qo,r/getdisciplined,1473,0.98,Reward yourself with some high dopamine activity after completing low dopamine work.,Rewards
fi82qo,r/getdisciplined,1473,0.98,Associate low dopamine with high dopamine activities.,Habit Formation
fi82qo,r/getdisciplined,1473,0.98,"Every-time you go to the park, listen to jazz, drink some coffee or anything else that you enjoy doing – have a good book and begin to read a few pages.",Habit Formation
