id,subreddit_name_prefixed,ups,upvote_ratio,advice,group
9t0gqz,r/getdisciplined,14992,0.98,"Build positive habits on a foundation of willpower, not motivation.",Habit Formation
9t0gqz,r/getdisciplined,14992,0.98,Start reading non-fiction and apply it in your life.,Reading
9t0gqz,r/getdisciplined,14992,0.98,"Work on your physiology, it should be the foundation for productivity and discipline.",Physiology
9t0gqz,r/getdisciplined,14992,0.98,Lessen the amount of superstimuli in your life to get more dopamine (motivation).,Dopamine
9t0gqz,r/getdisciplined,14992,0.98,"Flow activities should be the goal in life, not mind numbing pleasure.",Flow Activities
9t0gqz,r/getdisciplined,14992,0.98,Start a bullet journal where you color code all activities you do each day positive or negative.,Habit Tracking
lrrgup,r/getdisciplined,9669,0.97,"if you don’t exercise, eat nutritious food, get sunlight, consume positive material, surround yourself with support, then you aren’t giving yourself a fighting chance",Self-Care
lrrgup,r/getdisciplined,9669,0.97,I believe depression is legitimate,Mental Health
1mbhsfy,r/getdisciplined,8103,0.99,You need to separate your actions from your feelings!,Mindset
1mbhsfy,r/getdisciplined,8103,0.99,Don't lie to yourself by using your feelings as an excuse.,Honesty
1mbhsfy,r/getdisciplined,8103,0.99,"Don't say: 'I'm stressed, so I can't do it.'",Mindset
1mbhsfy,r/getdisciplined,8103,0.99,"I'm stressed, that's fine, so I'll do it stressed.",Action
1mbhsfy,r/getdisciplined,8103,0.99,"I'm unmotivated, so I'll work out unmotivated.",Action
1mbhsfy,r/getdisciplined,8103,0.99,"The problem with discipline is not the doing, it's the starting.",Insight
b9w7fx,r/getdisciplined,7179,0.99,"Optimism makes people perform better. Most importantly, the optimism that literally anything can be defeated with enough effort. Every obstacle is merely a challenge, not a threat.",Mindset
b9w7fx,r/getdisciplined,7179,0.99,"Habits are what form and deform your life. Humans are short-sighted. Build a ritual that will, much like compound interest, build an amazing life.",Habit Formation
b9w7fx,r/getdisciplined,7179,0.99,"Scale slowly. An overnight success still had 1 step up goals every hour. A billion dollar company once only had a goal of a million dollars. Set numerous small, achievable, bite sized goals - as opposed to a few, huge chunky goals.",Goal Setting
b9w7fx,r/getdisciplined,7179,0.99,"Authenticity is king. People enjoy authentic people, respect authentic people and welcome authentic people.",Authenticity
b9w7fx,r/getdisciplined,7179,0.99,"Common sense beats all rules, stipulations and otherwise. You likely know most of what you learn, it’s simply being reorganized to fit your mind better. When it’s time to take action, trust that you know what you’re doing and focus solely on moving.",Common Sense
b9w7fx,r/getdisciplined,7179,0.99,"Success comes from trying something, failing and modifying the action - Thousands of times. No amount of preparation (beyond the basic) can prepare you for the first day with sharks. ACTION + MODIFICATION = RESULTS",Success
b9w7fx,r/getdisciplined,7179,0.99,Show small amounts of gratitude every day. Make it apart of your ritual. The gratitude forces you to focus on the things you are happy about. Small gratitude is low commitment and high reward.,Gratitude
b9w7fx,r/getdisciplined,7179,0.99,Establish 3 to 20 second barriers between bad habits. Take batteries out the remote. Put junk food in trunk of car. It won’t stop you completely. But it will decrease significantly. Make positive habits easier. Pack a healthy lunch.,Habit Formation
b9w7fx,r/getdisciplined,7179,0.99,"A huge part of succeeding at something is simply showing up. Even if that means you just walked in the door and back out. If you show up, the math says you’ll succeed, eventually.",Persistence
b9w7fx,r/getdisciplined,7179,0.99,Go 150% + beyond what you are expected to do. This is a 100% way to gain immediate traction. Applied with consistency can skyrocket results.,Effort
b9w7fx,r/getdisciplined,7179,0.99,Practice task isolation. The only thing that matters in that moment is the task at hand. Work on that task only until you are ready to stop. Nothing else matters until.,Focus
b9w7fx,r/getdisciplined,7179,0.99,"Constantly be evaluating yourself. Every year, every month, week, day, hour. - Do this 100% objectively and healthily. The more you look at yourself objectively and decide what you’re doing right and wrong, the better feedback you can use to improve.",Self-Improvement
b9w7fx,r/getdisciplined,7179,0.99,"If you are always the smartest person in the room, you’re probably in a room full of idiots or you’re lying to yourself.",Self-Awareness
b9w7fx,r/getdisciplined,7179,0.99,Double down on your strengths. Neutralize your weaknesses. Make them just capable enough to swim still water.,Strengths
b9w7fx,r/getdisciplined,7179,0.99,"Adaptation is the key to survival. You cannot run over a jungle, but with the right small, frequent adjustments, you can run through a jungle.",Adaptability
b9w7fx,r/getdisciplined,7179,0.99,"Discipline is not just following a plan when you need a plan, but following the plan when you’ve succeeded. Make a plan and follow it, regardless of your emotions.",Discipline
b9w7fx,r/getdisciplined,7179,0.99,"When you first wake up, try breathing faster and faster until hyperventilation. It makes your body kick into awake mode quickly.",Morning Routine
b9w7fx,r/getdisciplined,7179,0.99,"Try fasting from a bad habit completely. Replace it with something less bad. Over time, you can replace a lot of small bad habits with less bad habits and get big change.",Habit Formation
b9w7fx,r/getdisciplined,7179,0.99,"Organization, habits and the process of planning is actually all simply tools to clear space in your brain. You cannot use a car efficiently if it is jammed to the ceiling with clothes and furniture that belong in your house. And the furniture and clothes can’t be used correctly either.",Organization
b9w7fx,r/getdisciplined,7179,0.99,"Take stock in the understanding that 90% of successful people are doing a lot of hustle underneath the glam and money. They wake up early, they skip parties and they work - A LOT.",Work Ethic
b9w7fx,r/getdisciplined,7179,0.99,Automate literally every task you do not enjoy. It will make your life focus on the things you do enjoy.,Efficiency
b9w7fx,r/getdisciplined,7179,0.99,Most habits can be changed by finding the belief rooted to it and finding all the evidence you can to break it. - “The gym is a chore.” *Watch documentaries about people who love the gym* 'I love sugary foods' *Watch documentaries about sugar causing disease* - You are what you subscribe to.,Habit Formation
b9w7fx,r/getdisciplined,7179,0.99,Tell no one your goals. Talking gives you a rush of endorphins and dopamine. You “dope yourself out” on talking and never get anywhere.,Goal Setting
b9w7fx,r/getdisciplined,7179,0.99,No amount of regret can bring back the dead. Love immensely and give your friends and family what they deserve as soon as possible and as often as possible.,Relationships
b9w7fx,r/getdisciplined,7179,0.99,"Chain together successful tasks and create the illustration of commitment, thus reducing your likelihood to miss out. - Crossing off days on a calendar chains a habit and thus reduces the chance to break it.",Commitment
b9w7fx,r/getdisciplined,7179,0.99,"Stage every commitment so you only give what you get back, and scale it slowly. Put in 1 cent, if it gives back 1 cent, then put in 5 cents. If it gives back 5 cents, continue. Never Give 100% to an idea you haven’t tested at 10%, 25%, 50%, 75% etc.",Commitment
b9w7fx,r/getdisciplined,7179,0.99,Never show your cards first in a negotiation. The offer they have in mind may be much higher than you’re thinking.,Negotiation
b9w7fx,r/getdisciplined,7179,0.99,"In a dispute, ask for proof of everything. Make the process draining for the other party if you’re in the right and they are forcing you to wade through mud.",Dispute Resolution
b9w7fx,r/getdisciplined,7179,0.99,"Every successful person saves money. EVERY. SUCCESSFUL. PERSON. SAVES. MONEY. Save, at the very least, 10%",Finance
b9w7fx,r/getdisciplined,7179,0.99,"Every successful person invests. Invest in a bank, invest in real estate, invest in yourself. No matter how you invest, it’s the only way to grow. Spend your money on things that grow. - This includes your health.",Finance
b9w7fx,r/getdisciplined,7179,0.99,Do not skip on insurance. The peace of mind that disaster will not ruin you is worth the duty paid.,Finance
b9w7fx,r/getdisciplined,7179,0.99,One of the most common failures in business & personal is the mismanagement of funds. Be very meticulous with how you spend your money.,Finance
b9w7fx,r/getdisciplined,7179,0.99,"Listen to people. Ask open-ended questions to get someone to talk. Why, what and how questions. To enhance listening, look for a one sentence life lesson to take from every story / interaction.",Communication
b9w7fx,r/getdisciplined,7179,0.99,"You are upset because no one calls you to do things. So is the person who didn’t call you. Initiate activity. This is a solid way to be invited to more things, meet new people and have fun.",Social Skills
b9w7fx,r/getdisciplined,7179,0.99,Group activities are always more comfortable.,Social Skills
b9w7fx,r/getdisciplined,7179,0.99,"Have a specific plan in place of who, what, when, where & why.",Planning
b9w7fx,r/getdisciplined,7179,0.99,Sometimes the event will fall apart. This is common. Do it anyways. It’s worth it.,Persistence
b9w7fx,r/getdisciplined,7179,0.99,Social people invite others out when they feel lonely. Antisocial people wait for a phone call. Antisocial people have a higher probability of being lonely.,Social Skills
b9w7fx,r/getdisciplined,7179,0.99,Traveling & expanding your social circle makes you more confident in who you are.,Confidence
b9w7fx,r/getdisciplined,7179,0.99,Be 10% more excited than the person you are talking to in positive conversations.,Communication
b9w7fx,r/getdisciplined,7179,0.99,"You have value to add to every interaction. Whether it’s with a CEO or a janitor. No matter your past - If you’ve burned many bridges, at least you had bridges to burn.",Self-Worth
b9w7fx,r/getdisciplined,7179,0.99,"If 10 people in a row reject you as a friend, that’s only .000000015 percent of the world’s population. You’ve got a whole lot more to choose from.",Perspective
b9w7fx,r/getdisciplined,7179,0.99,"Small talk is the door to deep friendship. You must make small talk first. You first said “Hi” to your significant other, you first had an interview at a company. People need to know you won’t stab them before they want to hang out.",Communication
b9w7fx,r/getdisciplined,7179,0.99,Letting go,Emotional Well-being
ic70lc,r/getdisciplined,6041,0.99,The root problem with many productivity issues is being constantly overstimulated.,Productivity
ic70lc,r/getdisciplined,6041,0.99,Try to sit somewhere for an hour or two and do nothing.,Mindfulness
ic70lc,r/getdisciplined,6041,0.99,"When feeling the urge to procrastinate, I've started to try to put it in a bit different perspective.",Procrastination
ic70lc,r/getdisciplined,6041,0.99,"Ok, Brain, we don't have to do it now. We can sit here the entire day and don't even start doing it. BUT we'll do NOTHING else.",Procrastination
ic70lc,r/getdisciplined,6041,0.99,What I've also noticed is how bad 'infotainment' can be for you.,Productivity
4xwrut,r/getdisciplined,5845,0.96,Learn to front-load your pain.,Emotional Regulation
4xwrut,r/getdisciplined,5845,0.96,Go ahead and feel it now so you don't have to feel it later.,Emotional Regulation
4xwrut,r/getdisciplined,5845,0.96,Embrace the yucky feeling and all.,Emotional Regulation
4xwrut,r/getdisciplined,5845,0.96,"If you can do this for three weeks consistently, you will change your life forever.",Consistency
4xwrut,r/getdisciplined,5845,0.96,Think of your actions as alchemy.,Mindset
4xwrut,r/getdisciplined,5845,0.96,You are taking time and adding energy to it to create a result.,Mindset
4xwrut,r/getdisciplined,5845,0.96,"If you take action haphazardly, you will have a meh kind of life.",Action
4xwrut,r/getdisciplined,5845,0.96,"If you're going to feel bad either way, you might as well take the action that will improve your life.",Action
1mrsmsh,r/getdisciplined,5571,0.99,"Discipline is doing the stuff you promised yourself you’d do, even when you’re tired, bored, or straight up not in the mood.",Self-Promises
1mrsmsh,r/getdisciplined,5571,0.99,"It’s studying when your brain says scroll, it’s cooking a simple meal instead of ordering junk, it’s closing the gap between what you said you’d do and what you actually do.",Self-Promises
1mrsmsh,r/getdisciplined,5571,0.99,"Discipline is not about perfection, it’s about trust. Every time you keep a promise to yourself, you build self-respect.",Self-Promises
1mrsmsh,r/getdisciplined,5571,0.99,"The real secret is never missing twice. You miss one workout, fine, but don’t miss the next.",Consistency
1mrsmsh,r/getdisciplined,5571,0.99,"Discipline is not about being perfect every single time, it’s about refusing to let your bad days outweigh your good ones.",Consistency
1mrsmsh,r/getdisciplined,5571,0.99,"Once you get this, your whole life changes. You stop living in theory and start living in action.",Action
a1sa3p,r/getdisciplined,4958,0.9,Breakfast IS NOT the most important meal of the day.,Nutrition
a1sa3p,r/getdisciplined,4958,0.9,Life is quite simple. It comes down to the same thing... putting one foot in front of the other. Showing up. Getting Started. Doing the work. It’s that simple.,Simplicity
a1sa3p,r/getdisciplined,4958,0.9,"Consistency. As long as you keep showing up and taking action, you will get better.",Consistency
a1sa3p,r/getdisciplined,4958,0.9,"Life is ALL a mental game. Your body and feet might be aching with pain as they bitch at you screaming at the top of their lungs telling you to stop and slow down, but if your mind refuses to listen, your body will continue to obey.",Mental Strength
a1sa3p,r/getdisciplined,4958,0.9,You only have as much energy as you use.,Energy
a1sa3p,r/getdisciplined,4958,0.9,People who love eating really should run (or do any other cardio intensive sport).,Fitness
a1sa3p,r/getdisciplined,4958,0.9,Making a real commitment is POWERFUL.,Commitment
a1sa3p,r/getdisciplined,4958,0.9,Challenging yourself is important.,Challenge
a1sa3p,r/getdisciplined,4958,0.9,Prepare ahead of time and prepare for the worst.,Preparation
a1sa3p,r/getdisciplined,4958,0.9,Life is all about the process and the journey. Not the destination.,Journey
a1sa3p,r/getdisciplined,4958,0.9,The Rain is AWESOME.,Mindset
a1sa3p,r/getdisciplined,4958,0.9,Being badass is subjective.,Mindset
n65ttc,r/getdisciplined,4928,0.99,Don’t tell anyone you’re starting shit,Privacy
n65ttc,r/getdisciplined,4928,0.99,Celebrate your success privately,Privacy
n65ttc,r/getdisciplined,4928,0.99,Allow yourself to cherish small daily wins,Personal Growth
n65ttc,r/getdisciplined,4928,0.99,Never stop starting over,Persistence
n65ttc,r/getdisciplined,4928,0.99,Do it for yourself and those you love,Motivation
n65ttc,r/getdisciplined,4928,0.99,Don’t start chasing applause and acclaim,Motivation
1kjwdte,r/getdisciplined,4068,0.93,"You need to be really, really kind and patient with yourself while you try to rewire your brain.",Self-Compassion
1kjwdte,r/getdisciplined,4068,0.93,"Believe you can do it, even when your brain makes logical arguments you can't.",Self-Belief
1kjwdte,r/getdisciplined,4068,0.93,I only need to make it through today.,Daily Focus
1kjwdte,r/getdisciplined,4068,0.93,Quitting everything at once means you don't need to play whack a mole with your multiple vices when you quit one.,Simultaneous Quitting
1kjwdte,r/getdisciplined,4068,0.93,You need to try as much as you can to see what works for you.,Personalized Approach
1kjwdte,r/getdisciplined,4068,0.93,"Instead of reaching for my phone, I get a tea, go for a walk, tend to my plants, read a book.",Healthy Alternatives
lw0bsm,r/getdisciplined,4035,0.98,Let go of your old identity,Self-Image
lw0bsm,r/getdisciplined,4035,0.98,Don’t compare your life to other people’s lives,Self-Comparison
lw0bsm,r/getdisciplined,4035,0.98,Don’t engage in behaviors that are preventing you from changing your life,Habit Formation
lw0bsm,r/getdisciplined,4035,0.98,Avoid people who are holding you back,Influences
lw0bsm,r/getdisciplined,4035,0.98,Don’t be too hard on yourself,Self-Compassion
lw0bsm,r/getdisciplined,4035,0.98,Change your life 1 small step at a time,Progress
lw0bsm,r/getdisciplined,4035,0.98,Get organized!,Organization
lw0bsm,r/getdisciplined,4035,0.98,Take care of your body,Health
lw0bsm,r/getdisciplined,4035,0.98,Spend time on internal growth,Personal Growth
lw0bsm,r/getdisciplined,4035,0.98,Improve your social skills,Social Skills
lw0bsm,r/getdisciplined,4035,0.98,Change your life in your 20s by helping others,Service
kxiaif,r/getdisciplined,3784,0.99,Don't procrastinate because you always want a fresh start. Just start whenever on that day.,Start Now
kxiaif,r/getdisciplined,3784,0.99,It's not a crime to end up doing something later than you intended on that day.,Flexibility
kxiaif,r/getdisciplined,3784,0.99,You don't have to guilt trip yourself into following an absolutely rigid schedule.,Flexibility
kxiaif,r/getdisciplined,3784,0.99,"Sometimes you have the motivation on that day later than expected, and that's okay, you should seize that moment.",Seize Moments
kxiaif,r/getdisciplined,3784,0.99,"If you're ready to go brush your teeth at 4pm, seize the moment. It's not too late just because you didn't have the energy to do it in the morning.",Seize Moments
kxiaif,r/getdisciplined,3784,0.99,"Don't listen to the voice that says, 'well, I was supposed to do it in the morning, so it's too late and there's no point.'",Positive Self-Talk
kxiaif,r/getdisciplined,3784,0.99,"It is okay to think 'I ate junk food on a day where I just want to eat healthy. But I can eat healthy for the rest of the day. I don't have to give up, just because I'm not perfect and this day wasn't perfect.",Resilience
1mi7xu4,r/getdisciplined,3765,0.98,"Set 3 daily non-negotiables. Small ones. Like drink 1L of water, 20-minute walk, 10-minute journal. Hit them no matter what.",Daily Habits
1mi7xu4,r/getdisciplined,3765,0.98,"Limit phone use in the morning. Your brain deserves peace, not chaos.",Morning Routine
1mi7xu4,r/getdisciplined,3765,0.98,"When you slip (and you will), don’t throw away the day. Salvage what you can. 50% effort is still better than 0%.",Resilience
1mi7xu4,r/getdisciplined,3765,0.98,Stop chasing motivation. Build discipline through action. You don’t need to be perfect. You just need to be consistent enough.,Discipline
1mi7xu4,r/getdisciplined,3765,0.98,"You become that person by doing the boring, hard, unsexy stuff every day, especially when you don’t feel like it.",Personal Growth
1mi7xu4,r/getdisciplined,3765,0.98,I got out of bed without snoozing. I drank water instead of grabbing my phone. I wrote down 3 things I wanted to do and I did them.,Morning Routine
kml9ui,r/getdisciplined,3576,0.99,"Shower. Not a bath, a shower. Use water as hot or cold as you like. You don’t even need to wash. Just get in under the water and let it run over you for a while. Sit on the floor if you gotta.",Self-Care
kml9ui,r/getdisciplined,3576,0.99,"Moisturize everything. Use whatever lotion you like. Unscented? Dollar store lotion? Fancy 48 hour lotion that makes you smell like a field of wildflowers? Use whatever you want, and use it all over your entire dermis.",Self-Care
kml9ui,r/getdisciplined,3576,0.99,"Put on clean, comfortable clothes. Put on your favorite underwear. Cute black lacy panties? Those ridiculous boxers you bought last christmas with candy cane hearts on the butt? Put them on.",Self-Care
kml9ui,r/getdisciplined,3576,0.99,"Drink cold water. Use ice. If you want, add some mint or lemon for an extra boost. I always use lemon.",Self-Care
kml9ui,r/getdisciplined,3576,0.99,Clean something. Doesn’t have to be anything big. Organize one drawer of a desk. Wash five dirty dishes. Do a load of laundry. Scrub the bathroom sink.,Productivity
kml9ui,r/getdisciplined,3576,0.99,"Blast music. Listen to something upbeat and dancey and loud, something that’s got lots of energy. Sing to it, dance to it, even if you suck at both.",Mood Boost
kml9ui,r/getdisciplined,3576,0.99,"Make food. Don’t just grab a granola bar to munch. Take the time and make food. Even if it’s ramen. Add something special to it, like a soft boiled egg or some veggies. Prepare food, it tastes way better, and you’ll feel like you accomplished something.",Productivity
kml9ui,r/getdisciplined,3576,0.99,"Make something. Write a short story or a poem, draw a picture, color a picture, fold origami, crochet or knit, sculpt something out of clay, anything artistic. Even if you don’t think you’re good at it. Create.",Creativity
kml9ui,r/getdisciplined,3576,0.99,Go outside. Take a walk. Sit in the grass. Look at the clouds. Smell flowers. Put your hands in the dirt and feel the soil against your skin.,Nature
kml9ui,r/getdisciplined,3576,0.99,"Call someone. Call a loved one, a friend, a family member, call a chat service if you have no one else to call. Talk to a stranger on the street. Have a conversation and listen to someone’s voice. If you can’t bring yourself to call, text or email or whatever, just have some social interaction with another person. Even if you don’t say much, listen to them. It helps.",Social Interaction
kml9ui,r/getdisciplined,3576,0.99,"Cuddle your pets if you have them/can cuddle them. Take pictures of them. Talk to them. Tell them how you feel, about your favorite movie, a new game coming out, anything.",Comfort
kml9ui,r/getdisciplined,3576,0.99,Remember that. Keep holding on. In case nobody has told you today I love you and you are worth your weight and them some in gold so be kind to yourself and most of all keep pushing on!!!!,Encouragement
z9q8hm,r/getdisciplined,3454,0.99,Establish your WHYs behind the many WHATs of your dreams,Purpose
z9q8hm,r/getdisciplined,3454,0.99,Consume less crap. Practice digital minimalism,Digital Minimalism
z9q8hm,r/getdisciplined,3454,0.99,Understand: The motivation to change things only happens once you come to accept the way things are,Acceptance
z9q8hm,r/getdisciplined,3454,0.99,Start small with tiny amounts of willpower,Small Steps
z9q8hm,r/getdisciplined,3454,0.99,Get good sleep. Cook and eat well. Practice good hygiene,Self-Care
z9q8hm,r/getdisciplined,3454,0.99,Be patient and self-compassionate,Patience
i44crd,r/getdisciplined,3214,0.99,"Don't think 'If I had only done XXX for the last year', instead think 'If I spend the next year doing XXX, just imagine how amazing it will be'",Mindset
i44crd,r/getdisciplined,3214,0.99,Just imagine how great I could get at guitar if I play consistently for the next 2 years?,Future Focused
i44crd,r/getdisciplined,3214,0.99,Just imagine how great shape I can be in if I eat healthy for the next 6 months?,Future Focused
i44crd,r/getdisciplined,3214,0.99,Just imagine how successful I will become if I spend the next year being more productive and spending less time distracting myself?,Future Focused
i44crd,r/getdisciplined,3214,0.99,What specific steps can I take today to improve my guitar skills?,Present Focused
i44crd,r/getdisciplined,3214,0.99,What is a healthy meal I can have for dinner tonight to get on the path towards getting in better shape?,Present Focused
i44crd,r/getdisciplined,3214,0.99,What is 1 thing I can do today that is productive?,Present Focused
1ewaqov,r/getdisciplined,3101,0.96,Complete what you want to complete right after you wake up,Morning Routine
1ewaqov,r/getdisciplined,3101,0.96,Meditation before doing anything at all,Morning Routine
1ewaqov,r/getdisciplined,3101,0.96,Avoid distractions in the morning,Morning Routine
1ewaqov,r/getdisciplined,3101,0.96,Write an application,Productivity
1ewaqov,r/getdisciplined,3101,0.96,Work on your CV,Productivity
1ewaqov,r/getdisciplined,3101,0.96,Go to the gym,Productivity
kf9t7n,r/getdisciplined,3077,0.98,If you try and live your life avoiding pain and suffering by not 'doing things' that you know would be beneficial to you. This 'avoidance' will only lead to more pain and suffering later on.,Embrace Pain
kf9t7n,r/getdisciplined,3077,0.98,"But, if you embrace the pain and suffering head on. It will lead to self-fulfillment and happiness.",Embrace Pain
kf9t7n,r/getdisciplined,3077,0.98,I realized this after spending 3 months of such poor discipline that I was going to bed in the mornings and waking up at night.,Discipline
kf9t7n,r/getdisciplined,3077,0.98,"Gaming and binge watching YouTube, obsessing over social media. Eating only when I was hungry. Not taking care of my hygiene because I was always so unmotivated and tired.",Discipline
kf9t7n,r/getdisciplined,3077,0.98,"And just generally feeling like crap, every.single.day. It got to the point where nothing was enjoyable and I didn't enjoy anything I did no matter how 'exciting' the game or movie etc should've/would've been if I wasn't like this.",Mental Health
kf9t7n,r/getdisciplined,3077,0.98,Even simple things like looking forward to a nice delicious meal or a warm shower or a freshly made bed was irrelevant to my meaningless existence.,Mental Health
kf9t7n,r/getdisciplined,3077,0.98,I was living just to simply 'exist' and nothing more.,Purpose
kf9t7n,r/getdisciplined,3077,0.98,"But, then I realized that to make my existence more meaningful. Say like how it felt when I was a kid, (everyone here remembers those times I'm sure. Those exhilarating moments of pure bliss and joy and laughter and happiness and living life because it was a joy to experience it.",Purpose
