id,subreddit_name_prefixed,ups,upvote_ratio,advice,group
m478jt,r/getdisciplined,2272,0.97,"I had to look within, and this was the answer to my questions!",Self-Reflection
m478jt,r/getdisciplined,2272,0.97,If you decide instead and say “I will wake up tomorrow 5 AM I don’t give a fuck what happens nothing can stop me” then you will do it.,Decision Making
m478jt,r/getdisciplined,2272,0.97,It’s irresponsable to make yourself the victim because you have so much power within that you can use to help people and impact the world positively,Empowerment
m478jt,r/getdisciplined,2272,0.97,"Think of all the people that are in your situation looking for someone to reach out, wouldn’t you like to be the one that helps instead of the one that needs help?",Helping Others
m478jt,r/getdisciplined,2272,0.97,Decide what to believe! What to do! What to care about!,Decision Making
m478jt,r/getdisciplined,2272,0.97,"Nobody is going to know your name in 10.000 years, so stop worrying about what anybody thinks!",Perspective
m478jt,r/getdisciplined,2272,0.97,"Stop bitching around and love life, live to your fullest, hug your loved ones and help strangers!",Life Philosophy
nprj8e,r/getdisciplined,2267,0.99,What you do today decides your tomorrow or the next 5 years.,Daily Action
nprj8e,r/getdisciplined,2267,0.99,Have an end goal in mind but focus on today.,Daily Action
nprj8e,r/getdisciplined,2267,0.99,You have 24 hrs to change your tomorrow and make it more predictable.,Daily Action
nprj8e,r/getdisciplined,2267,0.99,"Just the 24 hrs, forget everything else.",Daily Action
nprj8e,r/getdisciplined,2267,0.99,"If you workout today, get the project started today, etc.",Daily Action
nprj8e,r/getdisciplined,2267,0.99,At the end of the day you can look and see the changes you made in your life within a day.,Daily Action
nprj8e,r/getdisciplined,2267,0.99,This will eventually lead to achieving the bigger changes and goals you want to achieve.,Long-Term View
nprj8e,r/getdisciplined,2267,0.99,The reason we procrastinate a lot is because we want to see quick changes and knowing it will take time will make us have second thoughts or just procrastinate more.,Procrastination
nprj8e,r/getdisciplined,2267,0.99,"Instead, just focusing on the 24 hrs allows us to see more changes quickly since a day passes quicker than a month.",Daily Action
ljyrge,r/getdisciplined,2254,0.99,"Monks make a habit of cleaning every day, using it as a time to commune with nature and oneself.",Daily Habits
ljyrge,r/getdisciplined,2254,0.99,How one cleans is a reflection of one's heart,Mindfulness
ljyrge,r/getdisciplined,2254,0.99,"When cleaning, monks do not wish to be somewhere else or doing something different. They focus on making the best of the tasks they have in front of them",Focus
ljyrge,r/getdisciplined,2254,0.99,"Cleaning can be a difficult task to start with, as it often feels like it's getting in the way of things that have a more tangible result.",Motivation
ljyrge,r/getdisciplined,2254,0.99,The peace I've felt from focusing on cleaning has rippled through my life in how I organize everything and has quickly become one of the most important tasks on my to-do list.,Benefits
ljyrge,r/getdisciplined,2254,0.99,Cleaning is a great place to start if you are feeling lost or just need to recalibrate your relationship between work and reward.,Starting Point
1cu3977,r/getdisciplined,2250,0.97,Read something every day. Even just one page.,Reading
1cu3977,r/getdisciplined,2250,0.97,Write something every day. Even just one paragraph.,Daily Writing
1cu3977,r/getdisciplined,2250,0.97,Get some sun on your skin as early as you can in the day.,Health
1cu3977,r/getdisciplined,2250,0.97,Write down anything that resonates with you.,Reflection
1cu3977,r/getdisciplined,2250,0.97,Value your time above all else.,Time Management
1cu3977,r/getdisciplined,2250,0.97,Find hobbies that engage your mind and soul. Do them daily.,Personal Growth
1cu3977,r/getdisciplined,2250,0.97,Stop comparing you behind the scenes to every one else’s highlight reel.,Self-Comparison
1cu3977,r/getdisciplined,2250,0.97,Listen more than you speak.,Communication
1cu3977,r/getdisciplined,2250,0.97,Create more than you consume.,Creativity
1cu3977,r/getdisciplined,2250,0.97,Never say “yes” simply because you feel obligated.,Boundaries
1cu3977,r/getdisciplined,2250,0.97,"Look at your phone less, look at people’s eyes more.",Mindfulness
1cu3977,r/getdisciplined,2250,0.97,Revisit things that have brought you joy in the past. They will probably do it again.,Joy
1cu3977,r/getdisciplined,2250,0.97,"Drink more water, at least 3-4 litres.",Health
1cu3977,r/getdisciplined,2250,0.97,Limit your to-do list to the top 3 most important tasks of the day.,Time Management
1cu3977,r/getdisciplined,2250,0.97,Focus on living in the present moment.,Mindfulness
l9yp3m,r/getdisciplined,2235,0.99,"A fitness habit may seem to be taking away your energy and time, but it actually energizes your life force and allows you to experience more of life.",Health
l9yp3m,r/getdisciplined,2235,0.99,"A reading habit may seem to be boring, but it is actually multiplying your future income and making you an indispensable professional.",Learning Habits
l9yp3m,r/getdisciplined,2235,0.99,"A healthy eating habit may seem restrictive, but it is actually allowing you to indulge in desserts and fried foods occasionally without guilt.",Nutrition Habits
l9yp3m,r/getdisciplined,2235,0.99,"A saving habit may seem no fun, but it is actually giving you options to make career and life pivots in the long run even if there is an economic crisis.",Finance
l9yp3m,r/getdisciplined,2235,0.99,"When you honor your disciplines frequently or even better daily, it will protect you like no other in the face of life's unpredictability and thus giving you true freedom.",Discipline
l9yp3m,r/getdisciplined,2235,0.99,"Invest in your daily habits, rituals, and disciplines as it was truly a game-changer.",Habit Investment
m18tnu,r/getdisciplined,2223,0.99,Take OTC meds to help with pain,Pain Management
m18tnu,r/getdisciplined,2223,0.99,Follow a combination of advice for managing depression,Mental Health
m18tnu,r/getdisciplined,2223,0.99,Use reverse Pomodoro technique to manage studying,Productivity
m18tnu,r/getdisciplined,2223,0.99,Start with 20-25 minutes of break and 5 minutes of studying,Productivity
m18tnu,r/getdisciplined,2223,0.99,Gradually increase studying time as you feel more motivated,Productivity
mefzbm,r/getdisciplined,2213,0.98,"If you want to start a new habit, commit to doing it for only two minutes.",Habit Formation
mefzbm,r/getdisciplined,2213,0.98,Allow yourself to be satisfied with doing just two minutes without judgement.,Habit Formation
mefzbm,r/getdisciplined,2213,0.98,Find a habit that will improve your life.,Habit Formation
mefzbm,r/getdisciplined,2213,0.98,Allow yourself to do the bare minimum (2 minutes) per day.,Habit Formation
mefzbm,r/getdisciplined,2213,0.98,Do the habit every day until it becomes enjoyable.,Habit Formation
mefzbm,r/getdisciplined,2213,0.98,Naturally add more variety and complexity to the habit.,Habit Formation
mefzbm,r/getdisciplined,2213,0.98,"Remember, this brain is wired for short-term gratification not long-term fulfillment.",Mindset
mefzbm,r/getdisciplined,2213,0.98,Unrealistic goals require too much willpower to maintain.,Mindset
mefzbm,r/getdisciplined,2213,0.98,The mental battle is the hardest to overcome.,Mindset
mefzbm,r/getdisciplined,2213,0.98,"Once your mind accepts a product or habit as being a part of your identity, loyalty becomes the inevitable response.",Mindset
dndnjr,r/getdisciplined,2199,0.98,Consider reading 'Running on Empty: Overcome Your Childhood Emotional Neglect' by Jonice Webb,Book Recommendation
dndnjr,r/getdisciplined,2199,0.98,Recognize the reasons why you act in certain ways and trace them to your childhood,Self-Awareness
dndnjr,r/getdisciplined,2199,0.98,Fix the habits and behaviors that stem from your childhood experiences,Self-Improvement
dndnjr,r/getdisciplined,2199,0.98,"Read the whole book, not just the chapter on discipline",Book Recommendation
dndnjr,r/getdisciplined,2199,0.98,Consider reading 'Adult Children of Emotionally Immature Parents',Book Recommendation
dndnjr,r/getdisciplined,2199,0.98,"Treat your feelings carefully, even if you think you're just being weak",Emotional Well-being
dndnjr,r/getdisciplined,2199,0.98,Stay tuned with your feelings and be kind to yourself,Emotional Well-being
c6v0l1,r/getdisciplined,2182,0.98,Finally going to the gym and eating healthier.,Health
c6v0l1,r/getdisciplined,2182,0.98,Finally taking school seriously and studying like you never had before.,Education
c6v0l1,r/getdisciplined,2182,0.98,"Finally breaking your addiction to porn, cigarettes, alcohol, or food.",Habit Formation
c6v0l1,r/getdisciplined,2182,0.98,Finally putting the time in to look for a job.,Career
c6v0l1,r/getdisciplined,2182,0.98,Finally taking that step to becoming more social and extroverted.,Social Life
c6v0l1,r/getdisciplined,2182,0.98,"Finally taking the time to clean your apartment, bathroom, or room.",Home
c6v0l1,r/getdisciplined,2182,0.98,Finally taking the initiative to wash all your clothes.,Home
c6v0l1,r/getdisciplined,2182,0.98,Finally stepping up to take the trash out.,Home
lgulvq,r/getdisciplined,2113,0.99,Take a moment to feel for the shirt tag takes time—it’s the slower way to go about putting on a shirt in the dark.,Mindfulness
lgulvq,r/getdisciplined,2113,0.99,"Taking a minute to recoup after procrastinating on something; taking a second to allow for a little compassion and understanding, to exhale and remind yourself that you’re human and humans do illogical and short-sighted things; all that stuff burns a lot of time.",Self-Compassion
lgulvq,r/getdisciplined,2113,0.99,"Going for a walk and returning to your desk without any inclination to force it; fully content with just sitting there mindfully observant of all the inner chaos; allowing the stress and panic and frustration and resistance do its thing; let it twirl around your mental space, then wash out.",Mindfulness
lgulvq,r/getdisciplined,2113,0.99,Not trying to cram an unrealistic amount of work in a day; taking the time for yourself and for your physical and mental wellbeing; that’s definitely the slow way at getting stuff done—but only if you make the assumption that [productivity = butt in seat × number of hours].,Work-Life Balance
lgulvq,r/getdisciplined,2113,0.99,"Look at exercise and other positive lifestyle habits as an investment, one that slowly compounds returns in increased focus, creativity and those rarified ‘hey! I feel like working now!’ mental tokens to be redeemed the next time you sit at your desk, then you could argue that the slow way is really the fastest way to success.",Health Investment
lgulvq,r/getdisciplined,2113,0.99,"Go slow, to go fast.",Productivity
78s2si,r/getdisciplined,2110,0.95,Start a new routine today and it will be ingrained by New Years,Habit Formation
ul26za,r/getdisciplined,2108,0.99,The pain of not doing something outweighs the pain of doing it.,Motivation
ul26za,r/getdisciplined,2108,0.99,"When you start doing things, the pieces will come together.",Action
ul26za,r/getdisciplined,2108,0.99,It doesn’t matter if it’s not 100% perfect right away.,Perfectionism
ul26za,r/getdisciplined,2108,0.99,Just getting it started will unlock you and enable you to do great things.,Action
ul26za,r/getdisciplined,2108,0.99,Remember the pain of not doing it will outweigh the pain of doing it.,Motivation
ul26za,r/getdisciplined,2108,0.99,Now go do that thing. I believe in you!,Encouragement
lfbg7z,r/getdisciplined,2101,0.99,Stop treating yourself like damaged goods.,Self-Compassion
lfbg7z,r/getdisciplined,2101,0.99,"Your lack of discipline is not a personal characteristic, it’s the result of several complex factors.",Understanding Discipline
lfbg7z,r/getdisciplined,2101,0.99,To increase your level of awareness you need to study yourself like a scientist.,Self-Awareness
lfbg7z,r/getdisciplined,2101,0.99,Be kind to yourself and focus on getting those hours in.,Self-Compassion
lfbg7z,r/getdisciplined,2101,0.99,Life is long and discipline comes easier when you give it the respect it deserves.,Discipline Respect
1jn9r3w,r/getdisciplined,2101,0.98,You don’t need more motivation. You need discipline.,Mindset
1jn9r3w,r/getdisciplined,2101,0.98,You don’t need a “morning routine.” You need to actually do the work.,Action
1jn9r3w,r/getdisciplined,2101,0.98,You don’t need another self-help book. You need to apply what you already know.,Knowledge
1jn9r3w,r/getdisciplined,2101,0.98,Most people get stuck in the loop of consuming information but never taking action.,Action
1jn9r3w,r/getdisciplined,2101,0.98,"Self-improvement is boring, repetitive, and uncomfortable.",Mindset
1jn9r3w,r/getdisciplined,2101,0.98,It’s showing up every day when you don’t feel like it.,Consistency
1jn9r3w,r/getdisciplined,2101,0.98,It’s doing the same thing for months before seeing results.,Consistency
1jn9r3w,r/getdisciplined,2101,0.98,"The sooner you accept this, the faster you’ll grow.",Mindset
ipzwdd,r/getdisciplined,2094,0.99,"Notice the urge, get curious, feel the joy of letting go and repeat.",Mindfulness
ipzwdd,r/getdisciplined,2094,0.99,Turn toward the experience with curiosity and really observe what's happening in your body and mind.,Mindfulness
ipzwdd,r/getdisciplined,2094,0.99,Focus on being curious about the experience of your habit.,Mindfulness
ipzwdd,r/getdisciplined,2094,0.99,Pay attention to how you are feeling both physically and emotionally in that moment.,Mindfulness
ipzwdd,r/getdisciplined,2094,0.99,Perhaps you will then find joy in letting go of that behavior.,Mindfulness
ipzwdd,r/getdisciplined,2094,0.99,Being curious and exploring your habit engaging behavior helps you see what you get from it.,Mindfulness
ipzwdd,r/getdisciplined,2094,0.99,Mindfulness turned out to be twice as effective at helping people quit smoking as gold standard therapy.,Mindfulness
alb9mp,r/getdisciplined,2091,0.97,Be softer with you,Self-Care
alb9mp,r/getdisciplined,2091,0.97,You are a breathing thing,Self-Care
alb9mp,r/getdisciplined,2091,0.97,You are a memory to someone,Relationships
alb9mp,r/getdisciplined,2091,0.97,You are home to a life,Self-Care
cjj3za,r/getdisciplined,2090,0.99,Focus on the present moment and enjoy your time out,Mindfulness
cjj3za,r/getdisciplined,2090,0.99,Set specific times for project work at home,Time Management
cjj3za,r/getdisciplined,2090,0.99,Break down projects into smaller tasks to reduce overwhelm,Productivity
cjj3za,r/getdisciplined,2090,0.99,Find a balance between work and leisure activities,Work-Life Balance
cjj3za,r/getdisciplined,2090,0.99,Practice self-compassion and avoid self-criticism,Self-Care
nkk59h,r/getdisciplined,2084,0.99,"patting yourself on the back seems silly, but it's nowhere near as silly as kicking yourself in the butt for not being perfect",Self-Compassion
nkk59h,r/getdisciplined,2084,0.99,praise the work you do rather than the outcome,Self Praise
nkk59h,r/getdisciplined,2084,0.99,"It's more important to be on target, than to hit a bullseye",Focus
m1zi6d,r/getdisciplined,2064,0.99,Break your goals into levels of difficulty and complexity.,Goal Setting
m1zi6d,r/getdisciplined,2064,0.99,Figure out how to beat Level 1 first.,Goal Setting
m1zi6d,r/getdisciplined,2064,0.99,Ignore the rest until you complete the current level.,Goal Setting
m1zi6d,r/getdisciplined,2064,0.99,Be patient and compassionate with yourself.,Mindset
m1zi6d,r/getdisciplined,2064,0.99,Brainstorm and write out a plan for each level.,Planning
m1zi6d,r/getdisciplined,2064,0.99,Connect with just 10 ‘fans’ for Level 1.,Execution
m1zi6d,r/getdisciplined,2064,0.99,Collect items (hard and soft) to use on your quest.,Resources
m1zi6d,r/getdisciplined,2064,0.99,Pivot your focus and efforts as you progress.,Adaptation
7xzy1f,r/getdisciplined,2056,0.96,"Plans, programs, and schedules don't give you discipline - they require it.",Discipline
7xzy1f,r/getdisciplined,2056,0.96,Recognize anxiety/shame as a signal from the brain that there is a problem that needs your attention.,Self-Awareness
7xzy1f,r/getdisciplined,2056,0.96,Pay attention to what is actually happening and what you are telling yourself.,Self-Awareness
7xzy1f,r/getdisciplined,2056,0.96,"Override procrastination a bit this time, it will be easier next time.",Action
7xzy1f,r/getdisciplined,2056,0.96,The future doesn't exist. The only time you can take action is right now.,Present Focused
7xzy1f,r/getdisciplined,2056,0.96,Listen to yourself and act in line with what you want right here and now.,Self-Listening
wfe4po,r/getdisciplined,2051,0.97,"Take a deep breath, exhale and have faith.",Mindfulness
wfe4po,r/getdisciplined,2051,0.97,What's meant to be will be.,Acceptance
wfe4po,r/getdisciplined,2051,0.97,"Sometimes the best thing you can do is not think, not wonder, not imagine, not obsess.",Mindfulness
wfe4po,r/getdisciplined,2051,0.97,You will always win.,Positivity
wfe4po,r/getdisciplined,2051,0.97,Winning starts the moment you find the positive in a negative situation.,Positivity
iqwz5j,r/getdisciplined,2048,0.99,sit down on a chair and do nothing until I'm so bored I have to do something - usually the task,Focus
iqwz5j,r/getdisciplined,2048,0.99,remind myself to sit in a chair in the kitchen and do nothing until I'm ready to work on my assignments,Focus
iqwz5j,r/getdisciplined,2048,0.99,try to meditate,Focus
iqwz5j,r/getdisciplined,2048,0.99,alternate between the chair and my computer every 10 minutes,Focus
6ui9rw,r/getdisciplined,2050,0.95,"If I have two hours free, sometimes I make a conscious choice: would I rather spend it cleaning or reading a book?",Time Management
6ui9rw,r/getdisciplined,2050,0.95,It's important to keep fighting that laziness.,Motivation
6ui9rw,r/getdisciplined,2050,0.95,"Imagine you live in a house on the beach, and at the end of the garden is a wall that protects your house from the sea.",Metaphor
6ui9rw,r/getdisciplined,2050,0.95,"If you keep making the right choices, then for each one you make you'll feel a tiny bit better about yourself.",Self-Improvement
6ui9rw,r/getdisciplined,2050,0.95,It's not really about making the bed - it's about fighting that bigger decay.,Philosophy
1gugw00,r/getdisciplined,2046,0.99,I want to take care of myself,Self-Care
1gugw00,r/getdisciplined,2046,0.99,I want to have a fit body,Health
1gugw00,r/getdisciplined,2046,0.99,I want to have a healthy relationship,Relationships
1gugw00,r/getdisciplined,2046,0.99,I want to have a peaceful and clean environment,Environment
1gugw00,r/getdisciplined,2046,0.99,I want to have vast knowledge,Knowledge
1gugw00,r/getdisciplined,2046,0.99,I want to achieve the best version of myself,Personal Growth
1gugw00,r/getdisciplined,2046,0.99,Only the people with discipline can actually achieve it,Discipline
1gugw00,r/getdisciplined,2046,0.99,With discipline I can bring all these wants into my reality,Discipline
hchyfi,r/getdisciplined,2043,0.99,making a spreadsheet of your debt,Finance
hchyfi,r/getdisciplined,2043,0.99,enforcing a morning routine,Daily Habits
hchyfi,r/getdisciplined,2043,0.99,cooking yourself healthy meals,Healthy Living
hchyfi,r/getdisciplined,2043,0.99,no longer just running from your problems,Emotional Well-being
hchyfi,r/getdisciplined,2043,0.99,telling a toxic friend you don’t want to see them anymore,Relationships
hchyfi,r/getdisciplined,2043,0.99,getting a second job so you can have a savings account,Finance
hchyfi,r/getdisciplined,2043,0.99,figure out a way to accept yourself,Self-Acceptance
hchyfi,r/getdisciplined,2043,0.99,"taking deliberate, mandated breaks from living",Self-Care
hchyfi,r/getdisciplined,2043,0.99,making the choice to build a life you don’t need to regularly escape from,Life Choices
hchyfi,r/getdisciplined,2043,0.99,looking your failures and disappointments square in the eye and re-strategizing,Resilience
hchyfi,r/getdisciplined,2043,0.99,letting go,Emotional Well-being
hchyfi,r/getdisciplined,2043,0.99,choosing new,Personal Growth
hchyfi,r/getdisciplined,2043,0.99,disappointing some people,Relationships
hchyfi,r/getdisciplined,2043,0.99,making sacrifices for others,Altruism
hchyfi,r/getdisciplined,2043,0.99,letting yourself be normal. Regular. Unexceptional,Self-Acceptance
hchyfi,r/getdisciplined,2043,0.99,deciding your ultimate goal in life isn’t going to be having abs and keeping up with your fake friends,Life Goals
hchyfi,r/getdisciplined,2043,0.99,learning how to stop trying to “fix yourself” and start trying to take care of yourself,Self-Care
hchyfi,r/getdisciplined,2043,0.99,"being the hero of your life, not the victim",Personal Growth
hchyfi,r/getdisciplined,2043,0.99,no longer choosing a life that looks good over a life that feels good,Life Choices
hchyfi,r/getdisciplined,2043,0.99,giving the hell up on some goals so you can care about others,Altruism
hchyfi,r/getdisciplined,2043,0.99,being honest even if that means you aren’t universally liked,Honesty
hchyfi,r/getdisciplined,2043,0.99,meeting your own needs so you aren’t anxious and dependent on other people,Self-Reliance
hchyfi,r/getdisciplined,2043,0.99,becoming the person you know you want and are meant to be,Personal Growth
dw13td,r/getdisciplined,2036,0.98,Set an alarm and put it in the bathroom.,Alarm Placement
dw13td,r/getdisciplined,2036,0.98,"Remind yourself when you set the alarm that in the morning, when the alarm goes off, you will sit on the toilet and pee.",Morning Routine
dw13td,r/getdisciplined,2036,0.98,"After you pee, wash your hands.",Morning Routine
dw13td,r/getdisciplined,2036,0.98,"After you wash your hands, brush your teeth.",Morning Routine
dw13td,r/getdisciplined,2036,0.98,"After you brush your teeth, shave.",Morning Routine
dw13td,r/getdisciplined,2036,0.98,"After you shave, wash your face.",Morning Routine
dw13td,r/getdisciplined,2036,0.98,"By determining exactly what you would do after you hit the alarm in the morning, you remove the need to think and decide in that moment what you would do next after the alarm.",Morning Routine
dw13td,r/getdisciplined,2036,0.98,"Tell yourself that after you do Toilet, Hands, Teeth, Shave, and Face, that you can get back into bed if you are still tired.",Morning Routine
c3w405,r/getdisciplined,2030,0.99,Quit smoking weed and completely stopped drinking alcohol. Over a year sober from both.,Health
c3w405,r/getdisciplined,2030,0.99,"Work out 5 times a week, lifting weights and cardio every day.",Fitness
c3w405,r/getdisciplined,2030,0.99,"Work a basic retail job monday - friday 6 hours/day. This really helped me become more extroverted and talking to people is very easy now, i’d recommend this to everyone with poor social skills.",Social Skills
c3w405,r/getdisciplined,2030,0.99,"Saved a lot of money, spend as little as i can. Currently only pay for my phone, getting a haircut, the gym and sometimes a new piece of clothing/shoes.",Finance
c3w405,r/getdisciplined,2030,0.99,"Fixed my sleep schedule. I go to bed at 11, fall asleep around 12 and wake up at 8 every day, including weekends.",Health
c3w405,r/getdisciplined,2030,0.99,"Started taking care of myself. Shave, shower, use deodorant, fix my nails, brush my teeth morning & before bed, regularly get a hair cut and get my eyebrows fixed (excess hair)",Personal Care
c3w405,r/getdisciplined,2030,0.99,"Started reading every night to keep my focus on the right things. I read about finance, health, fitness etc. Anything i can learn from.",Self-Improvement
lv72bb,r/getdisciplined,2013,0.96,"I don't care if you need to hit that morning workout, or start studying for exam, do the laundry, approach that girl/guy, just start doing it",Just Start
lv72bb,r/getdisciplined,2013,0.96,"If you want to workout in the morning, sleep in your workout clothes and get that workout as soon as possible before your brain starts to play with you and makes excuses",Just Start
lv72bb,r/getdisciplined,2013,0.96,"When you see that cute girl, count to 5, approach her and introduce yourself before you overthink and start making excuses",Just Start
lv72bb,r/getdisciplined,2013,0.96,"The most important thing is to start, because in my experience movement creates motivation",Just Start
tfifk3,r/getdisciplined,2000,0.97,"We all have in our imagination this perfect, idealized version of ourselves. It’s where we’ve finally 'fixed' ourselves; where we’ve become able to practice monk-like levels self-discipline and self-control.",Self-Image
tfifk3,r/getdisciplined,2000,0.97,"Self-help methods and techniques are 'Step 2' of the solution. They won’t ever stick—you’ll forever be stuck in a 'one-step forward, two-steps back' rut—if you don’t start with 'Step 1'.",Self-Help
tfifk3,r/getdisciplined,2000,0.97,Step 1 is about learning to better react and respond to the consequences of not being perfect.,Self-Improvement
tfifk3,r/getdisciplined,2000,0.97,You’re adamantly obsessed with finding a core cause and cure for all your problems; you’re seeking prevention… while you’re neglecting to take care of all the mess on the floor.,Problem-Solving
tfifk3,r/getdisciplined,2000,0.97,"It’s called self-compassion. With self-compassion, you can sweep away your past failings. You can come to understand yourself and see how all your past 'failings' were done as an understandable coping mechanisms for the pain, stress or worry you’re constantly feeling.",Self-Compassion
tfifk3,r/getdisciplined,2000,0.97,"You deserve to forgive yourself. You deserve to accept and love yourself as you are now, today.",Self-Acceptance
tfifk3,r/getdisciplined,2000,0.97,"With self-compassion you can sweep away your present slip-ups, as they happen in real-time and shortly after. You can come to accept and anticipate being imperfect, so when it happens you can shrug and move on fast. You don't have to 'start-over' each time.",Self-Compassion
