id,subreddit_name_prefixed,ups,upvote_ratio,advice,group
4o0vos,r/getdisciplined,1785,0.92,"Your cravings and voice will disappear faster than you realise, but NEVER let your guard down.",Stay Vigilant
qqkhe4,r/getdisciplined,1782,0.97,I coded for a minimum of 5 minutes nearly every day for a year and a half,Consistency
qqkhe4,r/getdisciplined,1782,0.97,I had a good friend who is a software engineer who taught me a lot,Mentorship
qqkhe4,r/getdisciplined,1782,0.97,"I decided I was going to do it because the money is great, I like computers, and it would enable me to live the lifestyle I want",Motivation
qqkhe4,r/getdisciplined,1782,0.97,I only had to do 5 minutes made it easier to actually open my laptop and start studying,Consistency
qqkhe4,r/getdisciplined,1782,0.97,Focus on consistency because that's what gets you to the finish line,Consistency
qqkhe4,r/getdisciplined,1782,0.97,"If you force yourself to do at least 5 minutes, most of the time you end up doing more",Consistency
qqkhe4,r/getdisciplined,1782,0.97,find a mentor or an internship,Mentorship
qqkhe4,r/getdisciplined,1782,0.97,Use it in whatever you're trying to achieve,Application
kvebho,r/getdisciplined,1782,0.98,"Any time you have the urge to go check your phone or check your social media, and you feel like you need a lot of willpower to resist the urge, you may feel like you're too weak to resist or you just can't, that's WHEN you should resist it.",Resist Urge
kvebho,r/getdisciplined,1782,0.98,Show your greatest power when you feel the weakest.,Resist Urge
kvebho,r/getdisciplined,1782,0.98,"Focus on that, focus on knowing that you will have it much easier the next time, that the urge will be weaker.",Resist Urge
kvebho,r/getdisciplined,1782,0.98,"That's when the brain rewires itself, that's when if you do it again later it will be much easier.",Resist Urge
px92st,r/getdisciplined,1778,0.99,Don't use your phone absent-mindedly.,Mindful Use
px92st,r/getdisciplined,1778,0.99,"Before you use your phone, decide what you're going to look at or do.",Mindful Use
px92st,r/getdisciplined,1778,0.99,Simply breaking the mindless scrolling / clicking and asking yourself what you really want to see can break you out of that technology-trance.,Mindful Use
px92st,r/getdisciplined,1778,0.99,You will find most the time you don't even really want to see anything.,Mindful Use
px92st,r/getdisciplined,1778,0.99,"From that point you can break away from your phone and enjoy real-life again, doing something more productive or more rewarding than wasting time online looking for dopamine hits.",Mindful Use
ivu6ma,r/getdisciplined,1773,0.92,Respect yourself,Self-Care
ivu6ma,r/getdisciplined,1773,0.92,Do the right thing,Ethics
ivu6ma,r/getdisciplined,1773,0.92,Start journalling at the end of the day,Habit Formation
ivu6ma,r/getdisciplined,1773,0.92,Go for a walk when you get out of bed,Health
ivu6ma,r/getdisciplined,1773,0.92,Plug in your phone so it's not the first thing you grab when you get up,Habit Formation
ivu6ma,r/getdisciplined,1773,0.92,Set goals and then achieve them,Goal Setting
ivu6ma,r/getdisciplined,1773,0.92,"Be careful of anything that promises quick, miraculous results",Caution
jbgmao,r/getdisciplined,1765,0.99,write productive things you did and things you want to do in the future,Journaling
jbgmao,r/getdisciplined,1765,0.99,start today and see how it goes,Journaling
jbgmao,r/getdisciplined,1765,0.99,try for a couple days,Journaling
jbgmao,r/getdisciplined,1765,0.99,write them all down into the entry,Journaling
jbgmao,r/getdisciplined,1765,0.99,do small things that you know you will want to write down in the journal that night,Productivity
1mnbrpf,r/getdisciplined,1769,0.99,"Start embarrassingly small. I stopped trying to “overhaul” my life. I just did 5 push-ups, read 1 page, and worked for 5 minutes. Every. Single. Day. It was too small to fail.",Start Small
1mnbrpf,r/getdisciplined,1769,0.99,"Never miss twice. I will miss a day. You will miss a day. The golden rule: don’t miss two in a row. One slip is human, two is a habit forming in the wrong direction.",Consistency
1mnbrpf,r/getdisciplined,1769,0.99,"Identity > Goals. Instead of “I want to run,” I told myself: I am a runner. Instead of “I want to read,” I told myself: I am a reader. When your identity shifts, your actions follow.",Identity Shift
1mnbrpf,r/getdisciplined,1769,0.99,Stop looking for motivation. Pick one small thing and do it today. Not tomorrow. Not Monday. Today.,Action
fwg2r0,r/getdisciplined,1764,0.99,"Habits are everything. 99% of your future successes are done by your habits, also your failures too. Habits can make you your best version of yourself but they also can ruin you. Habits are like superpowers. Boring superpowers but still superpowers.",Habit Formation
fwg2r0,r/getdisciplined,1764,0.99,Perseverance. Don’t just give up on things. It’ll eventually work out. And if it doesn’t try something else as many times as needed. You’ll never regret something that you tried but you’ll always regret something that you didn’t. Regret is a huge motivator for me.,Perseverance
fwg2r0,r/getdisciplined,1764,0.99,Success is not a straight line. Oh no. Most things never work from the beginning so don’t get frustrated and dwell on your losses too much. Learn to let go. Don’t get attached to your ideas.,Success
fwg2r0,r/getdisciplined,1764,0.99,"Listen to your inner voice. You know when you’re doing something that you shouldn’t, right? That little voice doesn’t tell you what to do but it does tell you what NOT to do. Listen to it when it says: not to eat that 5th chocolate or not the open you 3rd bottle of beer.",Inner Voice
fwg2r0,r/getdisciplined,1764,0.99,Read/write a lot. Learn from other peoples mistakes.,Learning
fwg2r0,r/getdisciplined,1764,0.99,"Be your own hero and start things backwards. It may not be the right expression but English is not my first language so you’ll have to forgive me. I’ll explain what I mean. I bet you always imagine yourself that when you achieve this or that you’re going to change your lifestyle and your habits. The thing is you have to change your lifestyle and habits first and then to expect to become successful, not the other way.",Self-Improvement
nimd55,r/getdisciplined,1754,1.0,Look at yourself and ask 'what elements of my personality are holding me back and how can I get them on my side?',Self-Reflection
nimd55,r/getdisciplined,1754,1.0,You may have a part of yourself that doesn't like getting up in the morning. That's worth taking a look at.,Self-Reflection
nimd55,r/getdisciplined,1754,1.0,You may have a part of yourself that doesn't like to study. That's worth examining.,Self-Reflection
nimd55,r/getdisciplined,1754,1.0,I literally had to be like an adult to a child who just wanted pleasure and instant gratification.,Discipline
nimd55,r/getdisciplined,1754,1.0,I had to flex my willpower muscle and just fight against it.,Discipline
nimd55,r/getdisciplined,1754,1.0,"No, you can't surf the Internet randomly. No, you can't stay up past 11pm. No, you can't take drugs.",Discipline
nimd55,r/getdisciplined,1754,1.0,Zero days a week at the gym turned into 5 over time.,Habit Formation
nimd55,r/getdisciplined,1754,1.0,Random Internet surfing became nonexistent over time.,Habit Formation
nimd55,r/getdisciplined,1754,1.0,A nonexistent writing habit turned into 20 minutes of journaling every single day.,Habit Formation
nimd55,r/getdisciplined,1754,1.0,Saving none of my paycheck became 15% as the years passed.,Habit Formation
nimd55,r/getdisciplined,1754,1.0,No meditation transformed into 30 minute sessions in the morning and at night.,Habit Formation
nimd55,r/getdisciplined,1754,1.0,Multiple people having sway over my mood turned into me being a grounded and unshakable man.,Habit Formation
6sic3n,r/getdisciplined,1748,0.95,"You can rid yourself of many useless things among those that disturb you, for they lie entirely in your imagination; and you will then gain for yourself ample space by comprehending the whole universe in your mind, and by contemplating the eternity of time, and observing the rapid change of every part of everything, how short is the time from birth to dissolution, and the illimitable time before birth as well as the equally boundless time after dissolution",Perspective
6sic3n,r/getdisciplined,1748,0.95,"Remember that all we have is 'on loan' from Fortune, which can reclaim it without our permission—indeed, without even advance notice. Thus, we should love all our dear ones, but always with the thought that we have no promise that we may keep them forever—nay, no promise even that we may keep them for long.",Gratitude
6sic3n,r/getdisciplined,1748,0.95,"But neither a bull nor a noble-spirited man comes to be what he is all at once; he must undertake hard winter training, and prepare himself, and not propel himself rashly into what is not appropriate to him",Discipline
ki9efa,r/getdisciplined,1745,0.99,"if i lose a day, it doesn't matter because i have to make sure that I don't make a habit out of it",Habit Formation
c1cinm,r/getdisciplined,1749,0.97,"While having eyes closed, rotate your pupils clockwise and anti clockwise 10 times each. (full rotations)",Morning Routine
c1cinm,r/getdisciplined,1749,0.97,Don't forget to enjoy life,General Advice
ksabs5,r/getdisciplined,1741,0.99,"If you lose your job, then that would seem like a disaster at the time. However, if you get a better job, then you will look back at that job loss as a good thing.",Perspective
ksabs5,r/getdisciplined,1741,0.99,"When I don’t feel like doing something important, I will get thoughts like “This task sucks. I’m bored. Poor me. It’s going to take forever” etc.",Negative Self-Talk
ksabs5,r/getdisciplined,1741,0.99,The first chunk of time is spent internally moaning and the second part is the reluctant doing.,Productivity
ksabs5,r/getdisciplined,1741,0.99,"If I know I should cook dinner but want to get takeaway, I will question my thoughts. “What if I’m wrong that a takeout would be better than a home cooked meal?”, “What if I’m wrong that cooking sucks and is difficult?”",Questioning Assumptions
ksabs5,r/getdisciplined,1741,0.99,"I get out of my head, where everything seems awful, and move to action.",Action Over Thought
ksabs5,r/getdisciplined,1741,0.99,"I do a small experimental action, observe it, and then mentally record how bad it was.",Experimentation
ksabs5,r/getdisciplined,1741,0.99,"So don't force yourself to do anything, instead run a little experiment to see if you are right about a task being good or bad.",Experimentation
ksabs5,r/getdisciplined,1741,0.99,I guarantee you'll get some great results.,Encouragement
ju51ho,r/getdisciplined,1736,0.99,Let go of your 'if onlys' and build your happiness in the here and now.,Happiness
ju51ho,r/getdisciplined,1736,0.99,"Enjoy what you have right now and be happy, even if the only thing that you possess is the ability to breathe in and out.",Happiness
ju51ho,r/getdisciplined,1736,0.99,Accept that life will change and that we don't need external conditions for happiness.,Acceptance
ju51ho,r/getdisciplined,1736,0.99,Reduce the suffering we feel when things don't go as we hope.,Resilience
ju51ho,r/getdisciplined,1736,0.99,"Live calmer, happier lives by letting go of our attachment to things that we believe we need to be happy.",Detachment
svzz5h,r/getdisciplined,1731,0.99,I am a COMPETENT person and I will be good at anything I put time into.,Self-Confidence
svzz5h,r/getdisciplined,1731,0.99,I’m only ‘behind’ because other people already put work in.,Perspective
svzz5h,r/getdisciplined,1731,0.99,"If they can do it, I can do it. (No one is smarter or more capable than me)",Self-Confidence
svzz5h,r/getdisciplined,1731,0.99,The only reason I'll look into my neighbor's bowl is to see if they have enough.,Empathy
svzz5h,r/getdisciplined,1731,0.99,I’m in it for the long run. The person I will be tomorrow comes from the changes I make today.,Long-Term View
svzz5h,r/getdisciplined,1731,0.99,"In the long run, my success doesn’t come from my current value but from my current rate of change.",Growth Mindset
svzz5h,r/getdisciplined,1731,0.99,The only opinion that matters is mine.,Self-Validation
svzz5h,r/getdisciplined,1731,0.99,"Since the only opinion that matters is mine, it's easy to do the right thing when nobody's watching, because I am the only person that matters, and I am always watching me.",Integrity
clq5n0,r/getdisciplined,1730,0.99,"DO make a point to go practice, step by step, many times until you can be sure you're actually doing it.",Practice
clq5n0,r/getdisciplined,1730,0.99,DO realize that following a new idea needs PRACTICE. Many of these things are skills that you can't just do perfectly immediately even if they sound very easy.,Practice
clq5n0,r/getdisciplined,1730,0.99,DO write it down.,Organization
clq5n0,r/getdisciplined,1730,0.99,Keep a folder (paper or digital) to organize your life.,Organization
clq5n0,r/getdisciplined,1730,0.99,Always think on paper. Write everything down.,Organization
clq5n0,r/getdisciplined,1730,0.99,"Set GOALS. Goal-setting is a specific skill that you might think you know how to but actually don't. Setting goals right is simple, but not easy. There is a specific way to do it.",Goal Setting
clq5n0,r/getdisciplined,1730,0.99,"Keep lists of tasks for the DAY, WEEK, MONTH.",Task Management
clq5n0,r/getdisciplined,1730,0.99,Limit your work hours by keeping an UNSCHEDULE.,Time Management
clq5n0,r/getdisciplined,1730,0.99,"Keep LOGS. Logs work, that's scientifically proven.",Tracking
clq5n0,r/getdisciplined,1730,0.99,Always do the most important thing first.,Prioritization
clq5n0,r/getdisciplined,1730,0.99,Keep your barrier to entry low. Aim for LITTLE. Half an hour per day is enough sometimes.,Time Management
clq5n0,r/getdisciplined,1730,0.99,Keep in mind that you are always free. Procrastination is an unconscious fear for freedom that leads to avoidance.,Mindset
clq5n0,r/getdisciplined,1730,0.99,"Procrastination is a little like fear, and you can fight it. When your goals are clear and your free time is secured, when everything that's left unplanned is the one, the most difficult, the most important task: FORCE starting.",Procrastination
clq5n0,r/getdisciplined,1730,0.99,"Regular sleeping and eating patterns are important. Many people don't fully realize this, but those have an enormous positive effect on your psyche.",Health
clq5n0,r/getdisciplined,1730,0.99,"Caffeine might fuck up your sleep. If you want to get up early, you need to sleep early. If you want to sleep early, you need to be tired early.",Health
clq5n0,r/getdisciplined,1730,0.99,"You might be addicted to the internet which fucks up your sleep. When you are up too late, what are you doing? Are you on the web? Passively browsing is not tiring, it's keeping you awake.",Health
k3yosj,r/getdisciplined,1729,0.99,"If I want to start working out, then I have to find a suitable schedule to do it.",Action
k3yosj,r/getdisciplined,1729,0.99,"If I want to make art, then I have to figure out how to avoid exhausting myself.",Action
k3yosj,r/getdisciplined,1729,0.99,"If I want to buy a camera, then I have to start budgeting to save from my daily allowance.",Action
k3yosj,r/getdisciplined,1729,0.99,"The formula is: If I want to (goal), then I have to (simple solution you can start right away then gradually progress)",Mindset
k3yosj,r/getdisciplined,1729,0.99,"It is a matter of finding the right question, to find the best answer.",Mindset
k3yosj,r/getdisciplined,1729,0.99,It helps to give your mind a habit of thinking for solutions rather than thinking of excuses.,Mindset
k3yosj,r/getdisciplined,1729,0.99,It is important to use the formula in the right way as changing it will make a different sentence and might cause anxiety than solutions,Mindset
gdujdp,r/getdisciplined,1725,0.99,breaking a big task down into its smallest steps,Task Management
gdujdp,r/getdisciplined,1725,0.99,focusing on each small step,Task Management
gdujdp,r/getdisciplined,1725,0.99,write down all the small steps,Task Management
gdujdp,r/getdisciplined,1725,0.99,tick it off as I complete it,Task Management
gdujdp,r/getdisciplined,1725,0.99,This makes me more motivated,Motivation
1lp1hlc,r/getdisciplined,1725,0.96,Do something you absolutely hate every morning,Mindset
1lp1hlc,r/getdisciplined,1725,0.96,Give it a week minimum,Consistency
1lp1hlc,r/getdisciplined,1725,0.96,Go full cold from the start,Shock System
1lp1hlc,r/getdisciplined,1725,0.96,Don’t just 'get through it' — lean into it,Mindset
1lp1hlc,r/getdisciplined,1725,0.96,"Start with legs, arms then back, then chest, then head",Technique
u6vhcp,r/getdisciplined,1721,0.99,"You need to train to be able to lift that weight. Similarly, you can’t expect yourself to focus if you’ve never trained your brain to do so.",Brain Training
u6vhcp,r/getdisciplined,1721,0.99,You need to ignore the distractions and bring your focus back to work. This is really painful to do. But it’s supposed to be painful.,Focus
u6vhcp,r/getdisciplined,1721,0.99,The people that can focus intensely are the people that enjoy the painful process of focus.,Focus Enjoyment
u6vhcp,r/getdisciplined,1721,0.99,Find work that feels like play to you but work to other people. Then no one can compete with you.,Work Enjoyment
u6vhcp,r/getdisciplined,1721,0.99,You can focus intensely for about 90 minutes in one session after that you’re brain is done.,Focus Duration
u6vhcp,r/getdisciplined,1721,0.99,Workout session is only effective with rest afterwards. If you lift weights non-stop for hours you get injured.,Rest Importance
u6vhcp,r/getdisciplined,1721,0.99,You can schedule your first focus session two hours after waking.,Timing Focus
u6vhcp,r/getdisciplined,1721,0.99,"Do not waste your productive first 8 hours, it’s much easier to focus and have discipline during that time.",Productive Hours
u6vhcp,r/getdisciplined,1721,0.99,It’s also difficult to focus after eating a large meal specially carb and sugar heavy meal.,Focus and Food
u6vhcp,r/getdisciplined,1721,0.99,"During focus sessions take few seconds of rest and literally do nothing, your brain learns faster and performs better when you rest in between.",Rest During Focus
sziwo3,r/getdisciplined,1724,0.98,20% of success is just showing up.,Show Up
sziwo3,r/getdisciplined,1724,0.98,"Just get to the gym, open that book, pick up that instrument - whatever the case may be.",Show Up
sziwo3,r/getdisciplined,1724,0.98,There are no results without work on our part and the easiest way to start putting in the work is to start showing up.,Show Up
sziwo3,r/getdisciplined,1724,0.98,"Don’t overthink the process. Whatever it is that you’re trying to do, just show up.",Show Up
sziwo3,r/getdisciplined,1724,0.98,"Put in the reps, make time for it.",Show Up
sziwo3,r/getdisciplined,1724,0.98,Take the time to think about one area in your life where you're setting the bar too high.,Goal Setting
sziwo3,r/getdisciplined,1724,0.98,"Maybe it's a workout/study routine that takes too much energy, an alarm clock set too early that you continuously snooze, or a meditation routine you gave up on.",Goal Setting
sziwo3,r/getdisciplined,1724,0.98,Consider how you could make it easier (less demanding) and give it another go.,Goal Setting
n5e50h,r/getdisciplined,1721,0.99,Try focusing on discipline and building habits instead of motivation.,Discipline
n5e50h,r/getdisciplined,1721,0.99,Discipline is much more sustainable.,Discipline
n5e50h,r/getdisciplined,1721,0.99,Motivation is making yourself 'feel like' doing something while discipline is doing that thing whether you feel like it or not.,Discipline
n5e50h,r/getdisciplined,1721,0.99,Stop procrastinating all the time and actually get to work on doing the things that are important to me.,Procrastination
n5e50h,r/getdisciplined,1721,0.99,Stay disciplined and determined enough to keep that going for a longer period of time.,Discipline
n5e50h,r/getdisciplined,1721,0.99,Once the habit is built through discipline it becomes much much easier to keep doing the thing we have to do without much need for motivation.,Habit Formation
m7jyey,r/getdisciplined,1711,1.0,"Do your exercise, your task, create your own morning routine, try your own method.",Start Now
m7jyey,r/getdisciplined,1711,1.0,Do it first!,Start Now
m7jyey,r/getdisciplined,1711,1.0,"Improve with tips, tutorials, experiences on a subreddit, comparing with other methods.",Improve Later
m7jyey,r/getdisciplined,1711,1.0,Improve it after you get the job done.,Improve Later
c9oxs3,r/getdisciplined,1715,0.99,You should start working out more.,Self-Love
c9oxs3,r/getdisciplined,1715,0.99,You should start changing your diet and eating healthier.,Self-Love
c9oxs3,r/getdisciplined,1715,0.99,You should start doing things you enjoy.,Self-Love
c9oxs3,r/getdisciplined,1715,0.99,You should start spending time with friends.,Self-Love
c9oxs3,r/getdisciplined,1715,0.99,You should start meditating.,Self-Love
c9oxs3,r/getdisciplined,1715,0.99,Understand it isn’t your fault.,Self-Love
c9oxs3,r/getdisciplined,1715,0.99,People will only ever treat you the way they know how to treat themselves.,Self-Love
cfu8fp,r/getdisciplined,1709,0.91,"If something rubs you the wrong way, let me know.",Feedback
cfu8fp,r/getdisciplined,1709,0.91,"I appreciate the criticism as much as the positive, because your criticisms give me different perspective to look at my writing with.",Feedback
cfu8fp,r/getdisciplined,1709,0.91,"I know how to overcome alcohol, drug, and porn addictions.",Self-Improvement
cfu8fp,r/getdisciplined,1709,0.91,I know how to lose and gain weight.,Self-Improvement
cfu8fp,r/getdisciplined,1709,0.91,I know how to cultivate a healthier diet.,Self-Improvement
cfu8fp,r/getdisciplined,1709,0.91,"I know how to interact with men and women, and pick up on signs of interest and attraction.",Social Skills
cfu8fp,r/getdisciplined,1709,0.91,"I know how to develop and improve one’s charisma, confidence, and self-esteem.",Self-Improvement
cfu8fp,r/getdisciplined,1709,0.91,"I know the importance of mental and emotional health, and how to develop them for a fulfilling life.",Self-Improvement
cfu8fp,r/getdisciplined,1709,0.91,"You must believe, and develop faith in your mind first, before you can do anything.",Mindset
cfu8fp,r/getdisciplined,1709,0.91,"I ate, slept, and dreamt of this moment.",Mindset
cfu8fp,r/getdisciplined,1709,0.91,I told myself everyday that I’d achieve X success.,Mindset
cfu8fp,r/getdisciplined,1709,0.91,I wrote down my goals every single day.,Mindset
cfu8fp,r/getdisciplined,1709,0.91,I always imagined what my success would look like.,Mindset
cfu8fp,r/getdisciplined,1709,0.91,"I told myself I was successful, and eventually I came true.",Mindset
in1mqi,r/getdisciplined,1709,0.98,Stop relying on discipline a.k.a “Willpower” and leverage your chimp mind and brain patterns to do the things you want to do.,Mindset
in1mqi,r/getdisciplined,1709,0.98,Make the things you need/want to do easy.,Environment
in1mqi,r/getdisciplined,1709,0.98,Humans always take the path of least resistance.,Human Nature
in1mqi,r/getdisciplined,1709,0.98,When you change your environment your able to change where the path of least resistance goes.,Environment
in1mqi,r/getdisciplined,1709,0.98,Discipline is less so an act of willpower but more so an act of making the things important to you easy to do.,Discipline
in1mqi,r/getdisciplined,1709,0.98,Learning how your brain fundamentally chooses what your next move is is foundational to learning how to take advantage of it to actually accomplish the things you want to do.,Brain Science
x3qigs,r/getdisciplined,1702,0.98,I kept going fighting through the pain and fighting until that voice in my head begging me to stop finally gave up!,Mental Toughness
x3qigs,r/getdisciplined,1702,0.98,"I ignored my limits, ignored the pain and I focused on the results.",Focus on Results
x3qigs,r/getdisciplined,1702,0.98,Every single person in that building all working towards the same goal.,Community Support
x3qigs,r/getdisciplined,1702,0.98,Surrounded by veterans who have already reached the goal I'm working towards.,Inspiration
x3qigs,r/getdisciplined,1702,0.98,"I am officially a gym rat now, I love the fucking gym, it will be my second home.",Gym Enthusiasm
k30w3y,r/getdisciplined,1701,0.96,Replace self-pity with gratitude.,Emotional Regulation
k30w3y,r/getdisciplined,1701,0.96,Hold onto your power and forgive others.,Forgiveness
k30w3y,r/getdisciplined,1701,0.96,Embrace change.,Adaptability
k30w3y,r/getdisciplined,1701,0.96,Don't get distracted by things that you can't control.,Focus
k30w3y,r/getdisciplined,1701,0.96,Being ready to sometimes displease makes you stronger.,Assertiveness
k30w3y,r/getdisciplined,1701,0.96,Take calculated risks.,Risk-Taking
k30w3y,r/getdisciplined,1701,0.96,Come to terms with the past.,Resilience
k30w3y,r/getdisciplined,1701,0.96,Avoid repeating the same mistakes.,Discipline
k30w3y,r/getdisciplined,1701,0.96,Don't envy other people's success but rather seek to collaborate with them.,Collaboration
k30w3y,r/getdisciplined,1701,0.96,"Don't give up easily, and be self-compassionate about failure.",Persistence
k30w3y,r/getdisciplined,1701,0.96,Be comfortable being alone and use meditation to become more resilient.,Self-Care
k30w3y,r/getdisciplined,1701,0.96,Concentrate on giving rather than talking.,Generosity
k30w3y,r/getdisciplined,1701,0.96,Recognize that achievements take time and that progress isn't always immediately apparent.,Patience
nohikx,r/getdisciplined,1691,0.99,Purpose drives priority. Priority drives action. Action drives results.,Purpose
nohikx,r/getdisciplined,1691,0.99,Start by picturing success in your mind. Make it awe-inspiring. Think big and unrestricted. Don’t ask how. Be specific.,Vision
